Grapheme	IPA	Note
^borboleta$	b u ɾ b u l ɛ t ɐ
^crânio$	k ɾ ɐ n j u
^seco$	s e k u
^falta$	f a ɫ t ɐ
^óleo$	ɔ l i u
^rede$	ʁ ɛ d ɨ
^cobre$	k ɔ b ɾ ɨ
^leal$	l i a ɫ
^sexta-feira$	s ɨ ʃ t ɐ f ɐi ɾ ɐ
^criança$	k ɾ j ɐ̃ s ɐ
^arar$	ɐ ɾ a ɾ
^montanha$	m õ t ɐ ɲ ɐ
^cobra$	k ɔ b ɾ ɐ
^parte$	p a ɾ t ɨ
^oceano$	o s i ɐ n u
^varrão$	v ɐ ʁ ɐ̃ũ
^amanhecer$	ɐ m ɐ ɲ ɨ s e ɾ
^cobertor$	k u b ɨ ɾ t o ɾ
^sopa$	s o p ɐ
^promontório$	p ɾ u m õ t ɔ ɾ j u
^mudo$	m u d u
^permitir$	p ɨ ɾ m i t i ɾ
^estar_em_pé$	ʃ t a ɾ + ɐ̃ĩ + p ɛ
^roupa$	ʁ o p ɐ
^raposa$	ʁ ɐ p ɔ z ɐ
^terreno$	t ɨ ʁ e n u
^deitar-se$	d ɐi t a ɾ s ɨ
^imitar$	i m i t a ɾ
^tolo$	t ɔ l u
^nuca$	n u k ɐ
^assobiar$	ɐ s u b j a ɾ
^inveja$	ĩ v ɐ ʒ ɐ
^gelo$	ʒ ɛ l u
^dedo_do_pé$	d ɛ d u + d u + p ɛ
^inocente$	i n u s ẽ t ɨ
^nora$	n ɔ ɾ ɐ
^pântano$	p ɐ̃ t ɐ n u
^tornozelo$	t u ɾ n u z ɛ l u
^negro$	n ɛ ɡ ɾ u
^chouriço$	ʃ o ɾ i s u
^soprar$	s u p ɾ a ɾ
^chão$	ʃ ɐ̃ũ
^carne$	k a ɾ n ɨ
^amaldiçoar$	ɐ m a ɫ d i s u a ɾ
^pestanejar$	p ɨ ʃ t ɐ n ɨ ʒ a ɾ
^porco$	p ɔ ɾ k u
^bolota$	b u l ɔ t ɐ
^verdadeiro$	v ɨ ɾ d ɐ d ɐi ɾ u
^pegar_em_armadilha$	p ɨ ɡ a ɾ + ɐ̃ĩ + ɐ ɾ m ɐ d i ʎ ɐ
^manto$	m ɐ̃ t u
^você$	v u s e
^bosque$	b ɔ s k w ɨ
^chefe$	ʃ ɛ f ɨ
^tio$	t j ɔ
^azeite$	ɐ z ɐi t ɨ
^parecer$	p ɐ ɾ ɨ s e ɾ
^aveia$	ɐ v ɐi ɐ
^beira$	b ɐi ɾ ɐ
^queixo$	k w ɐi ʃ u
^almofada$	a ɫ m u f a d ɐ
^poste$	p ɔ ʃ t ɨ
^três_vezes$	t ɾ e ʃ + v ɛ z ɨ ʃ
^ela$	ɛ l ɐ
^mercado$	m ɨ ɾ k a d u
^falcão$	f a ɫ k ɐ̃ũ
^empola$	ẽ p ɔ l ɐ
^linguiça$	l ĩ ɡ i s ɐ
^gorro$	ɡ ɔ ʁ u
^potro$	p ɔ t ɾ u
^muco$	m u k u
^cera$	s ɛ ɾ ɐ
^útero$	u t ɨ ɾ u
^baixar$	b ɐi ʃ a ɾ
^cotovelo$	k u t u v ɛ l u
^cintura$	s ĩ t u ɾ ɐ
^campo$	k ɐ̃ p u
^navio$	n a v j u
^estorvar$	ʃ t u ɾ v a ɾ
^agudo$	ɐ ɡ u d u
^cão$	k ɐ̃ũ
^trazer$	t ɾ ɐ z e ɾ
^legumes$	l ɨ ɡ u m ɨ ʃ
^restituir$	ʁ ɨ ʃ t i t ui ɾ
^babar$	b ɐ b a ɾ
^novo$	n ɔ v u
^fraco$	f ɾ a k u
^feitiçaria$	f ɐi t i s ɐ ɾ i ɐ
^prometer$	p ɾ u m ɨ t e ɾ
^remo$	ʁ ɛ m u
^dirigir$	d i ɾ i ʒ i ɾ
^umbral$	ũ b ɾ a ɫ
^mocho$	m ɔ ʃ u
^burro$	b u ʁ u
^abraçar$	ɐ b ɾ ɐ s a ɾ
^massa$	m a s ɐ
^barba$	b a ɾ b ɐ
^dormir$	d u ɾ m i ɾ
^soalho$	s u a ʎ u
^surpreso$	s u ɾ p ɾ ɛ z u
^machado$	m ɐ ʃ a d u
^brilhar$	b ɾ i ʎ a ɾ
^queimar$	k w ɐi m a ɾ
^rainha$	ʁ ai ɲ ɐ
^porta$	p ɔ ɾ t ɐ
^leão$	l j ɐ̃ũ
^pedreiro$	p ɨ d ɾ ɐi ɾ u
^negativo$	n ɨ ɡ ɐ t i v u
^médico$	m ɛ d i k u
^úbere$	u b ɨ ɾ ɨ
^cavar$	k ɐ v a ɾ
^não_acertar$	n ɐ̃ũ + ɐ s ɨ ɾ t a ɾ
^café_da_manhã$	k ɐ f ɛ + d ɐ + m ɐ ɲ ɐ̃
^primo$	p ɾ i m u
^malagueta$	m ɐ l ɐ ɡ w ɛ t ɐ
^gêmeos$	ʒ e m i u ʃ
^garanhão$	ɡ ɐ ɾ ɐ ɲ ɐ̃ũ
^prata$	p ɾ a t ɐ
^inimigo$	i n i m i ɡ u
^cachorro$	k ɐ ʃ ɔ ʁ u
^sobrinha$	s u b ɾ i ɲ ɐ
^tingir$	t ĩ ʒ i ɾ
^anel$	ɐ n ɛ ɫ
^quinta-feira$	k ĩ t ɐ f ɐi ɾ ɐ
^perjúrio$	p ɨ ɾ ʒ u ɾ j u
^pregar$	p ɾ ɨ ɡ a ɾ
^maré_alta$	m ɐ ɾ ɛ + a ɫ t ɐ
^maduro$	m ɐ d u ɾ u
^adorar$	ɐ d u ɾ a ɾ
^transpirar$	t ɾ ɐ̃ ʃ p i ɾ a ɾ
^macaco$	m ɐ k a k u
^presságio$	p ɾ ɨ s a ʒ j u
^ombreira$	õ b ɾ ɐi ɾ ɐ
^parar$	p ɐ ɾ a ɾ
^mente$	m ẽ t ɨ
^acusar$	ɐ k u z a ɾ
^ave$	a v ɨ
^boi$	b oi
^verde$	v ɛ ɾ d ɨ
^concha$	k õ ʃ ɐ
^mesa$	m ɛ z ɐ
^alfinete$	a ɫ f i n ɛ t ɨ
^pulseira$	p u ɫ s ɐi ɾ ɐ
^vocês$	v u s e ʃ
^cozinhado$	k u z i ɲ a d u
^medo$	m e d u
^relógio$	ʁ ɨ l ɔ ʒ j u
^formiga$	f u ɾ m i ɡ ɐ
^relva$	ʁ ɛ ɫ v ɐ
^chaleira$	ʃ ɐ l ɐi ɾ ɐ
^dar$	d a ɾ
^às_vezes$	a ʃ + v ɛ z ɨ ʃ
^chamar$	ʃ ɐ m a ɾ
^acha$	a ʃ ɐ
^barrão$	b ɐ ʁ ɐ̃ũ
^cadeia$	k ɐ d ɐi ɐ
^raio$	ʁ ai u
^azedo$	ɐ z ɛ d u
^chapéu$	ʃ ɐ p ɛu
^achar$	ɐ ʃ a ɾ
^bananeira$	b ɐ n ɐ n ɐi ɾ ɐ
^bonito$	b u n i t u
^pendurar$	p ẽ d u ɾ a ɾ
^flecha$	f l ɐ ʃ ɐ
^bater$	b ɐ t e ɾ
^sapateiro$	s ɐ p ɐ t ɐi ɾ u
^sorrir$	s u ʁ i ɾ
^lagarto$	l ɐ ɡ a ɾ t u
^estômago$	ʃ t o m ɐ ɡ u
^escavar$	ʃ k ɐ v a ɾ
^porrete$	p u ʁ ɛ t ɨ
^vespa$	v ɛ ʃ p ɐ
^poncho$	p õ ʃ u
^padrasto$	p ɐ d ɾ a ʃ t u
^amoldar$	ɐ m ɔ ɫ d a ɾ
^rã$	ʁ ɐ̃
^plantar$	p l ɐ̃ t a ɾ
^cobrir$	k u b ɾ i ɾ
^grosso$	ɡ ɾ ɔ s u
^taxa$	t a ʃ ɐ
^emprestar$	ẽ p ɾ ɨ ʃ t a ɾ
^rim$	ʁ ĩ
^mosquito$	m u s k i t u
^desatar$	d ɨ z ɐ t a ɾ
^estender$	ʃ t ẽ d e ɾ
^estranho$	ʃ t ɾ ɐ ɲ u
^chaga$	ʃ a ɡ ɐ
^fungar$	f ũ ɡ a ɾ
^lenço$	l ẽ s u
^senhor$	s ɨ ɲ ɔ ɾ
^terra_firme$	t ɛ ʁ ɐ + f i ɾ m ɨ
^pegada$	p ɨ ɡ a d ɐ
^esburacar$	ʒ b u ɾ ɐ k a ɾ
^branco$	b ɾ ɐ̃ k u
^baía$	b ɐ i ɐ
^cabaça$	k ɐ b a s ɐ
^cacique$	k ɐ s i k w ɨ
^bochecha$	b u ʃ ɐ ʃ ɐ
^embriagado$	ẽ b ɾ j ɐ ɡ a d u
^ancinho$	ɐ̃ s i ɲ u
^velho$	v ɛ ʎ u
^descendentes$	d ɨ ʃ s ẽ d ẽ t ɨ ʃ
^sempre$	s ẽ p ɾ ɨ
^tocar$	t u k a ɾ
^algodão$	a ɫ ɡ u d ɐ̃ũ
^criado$	k ɾ j a d u
^orar$	o ɾ a ɾ
^trair$	t ɾ ɐ i ɾ
^conjeturar$	k õ ʒ ɨ t u ɾ a ɾ
^quando$	k w ɐ̃ d u
^fogão$	f u ɡ ɐ̃ũ
^mendigo$	m ẽ d i ɡ u
^mostrar$	m u ʃ t ɾ a ɾ
^voz$	v ɔ ʃ
^eu$	eu
^espirrar$	ʃ p i ʁ a ɾ
^perguntar$	p ɨ ɾ ɡ ũ t a ɾ
^porca$	p ɔ ɾ k ɐ
^orvalho$	o ɾ v a ʎ u
^como$	k ɔ m u
^remoinho$	ʁ ɨ m oi ɲ u
^difícil$	d i f i s i ɫ
^casa_de_homens$	k a z ɐ + d ɨ + ɔ m ẽ ʃ
^espremer$	ʃ p ɾ ɨ m e ɾ
^louco$	l o k u
^urinar$	u ɾ i n a ɾ
^sangue$	s ɐ̃ ɡ w ɨ
^esconder$	ʃ k õ d e ɾ
^genro$	ʒ ẽ ʁ u
^bom$	b õ
^tripas$	t ɾ i p ɐ ʃ
^pastor$	p ɐ ʃ t o ɾ
^espelho$	ʃ p ɐ ʎ u
^cabo$	k a b u
^copo$	k ɔ p u
^rato$	ʁ a t u
^madeira$	m ɐ d ɐi ɾ ɐ
^velha$	v ɛ ʎ ɐ
^alto$	a ɫ t u
^família$	f ɐ m i l i ɐ
^corvo$	k ɔ ɾ v u
^preocupação$	p ɾ i u k u p ɐ s ɐ̃ũ
^são$	s ɐ̃ũ
^dobrar$	d u b ɾ a ɾ
^gruta$	ɡ ɾ u t ɐ
^costela$	k u ʃ t ɛ l ɐ
^funda$	f ũ d ɐ
^e$	i
^rama_bifurcada$	ʁ ɐ m ɐ + b i f u ɾ k a d ɐ
^eixo$	ɐi ʃ u
^atirar$	ɐ t i ɾ a ɾ
^intestinos$	ĩ t ɨ ʃ t i n u ʃ
^casa_de_jardim$	k a z ɐ + d ɨ + ʒ ɐ ɾ d ĩ
^baixo$	b ai ʃ u
^quente$	k w ẽ t ɨ
^necessidade$	n ɨ s ɨ s i d a d ɨ
^saia$	s ai ɐ
^cor$	k ɔ ɾ
^sim$	s ĩ
^janela$	ʒ ɐ n ɛ l ɐ
^escorregar$	ʃ k u ʁ ɨ ɡ a ɾ
^governar$	ɡ u v ɨ ɾ n a ɾ
^cachimbo$	k ɐ ʃ ĩ b u
^lei$	l ɐi
^bolso$	b ɔ ɫ s u
^surdo$	s u ɾ d u
^desaparecer$	d ɨ z ɐ p ɐ ɾ ɨ s e ɾ
^agarrar$	ɐ ɡ ɐ ʁ a ɾ
^mil$	m i ɫ
^alma$	a ɫ m ɐ
^sogro$	s ɔ ɡ ɾ u
^tatuagem$	t ɐ t w a ʒ ɐ̃ĩ
^prego$	p ɾ ɛ ɡ u
^matrimônio$	m ɐ t ɾ i m o n j u
^ninho$	n i ɲ u
^cascata$	k ɐ ʃ k a t ɐ
^coceira$	k u s ɐi ɾ ɐ
^alegre$	ɐ l ɛ ɡ ɾ ɨ
^irmã_mais_nova$	i ɾ m ɐ̃ + m ai ʒ + n ɔ v ɐ
^hospedeiro$	o ʃ p ɨ d ɐi ɾ u
^esfera$	ʃ f ɛ ɾ ɐ
^corno$	k ɔ ɾ n u
^escutar$	ʃ k u t a ɾ
^mudar$	m u d a ɾ
^próximo$	p ɾ ɔ s i m u
^cesta$	s ɛ ʃ t ɐ
^templo$	t ẽ p l u
^guerra$	ɡ w ɛ ʁ ɐ
^obscuro$	o b ʃ k u ɾ u
^cauda$	k au d ɐ
^elogiar$	i l u ʒ j a ɾ
^juramento$	ʒ u ɾ ɐ m ẽ t u
^frente$	f ɾ ẽ t ɨ
^frigir$	f ɾ i ʒ i ɾ
^amar$	ɐ m a ɾ
^pobre$	p ɔ b ɾ ɨ
^curvar$	k u ɾ v a ɾ
^planta$	p l ɐ̃ t ɐ
^feltro$	f ɛ ɫ t ɾ u
^pé$	p ɛ
^rocha$	ʁ ɔ ʃ ɐ
^cem$	s ɐ̃ĩ
^peixe$	p ɐi ʃ ɨ
^bastão$	b ɐ ʃ t ɐ̃ũ
^parentes$	p ɐ ɾ ẽ t ɨ ʃ
^lamber$	l ɐ̃ b e ɾ
^beber$	b ɨ b e ɾ
^fruta_cítrica$	f ɾ u t ɐ + s i t ɾ i k ɐ
^omoplata$	o m u p l a t ɐ
^pedra$	p ɛ d ɾ ɐ
^exército$	i z ɛ ɾ s i t u
^acabar$	ɐ k ɐ b a ɾ
^esquecer-se$	s k w ɨ s ɛ ɾ s ɨ
^escorrer$	ʃ k u ʁ e ɾ
^compartilhar$	k õ p ɐ ɾ t i ʎ a ɾ
^veneno$	v ɨ n ɛ n u
^embotado$	ẽ b u t a d u
^trocar$	t ɾ u k a ɾ
^saco$	s a k u
^figo$	f i ɡ u
^apressar$	ɐ p ɾ ɨ s a ɾ
^manhã$	m ɐ ɲ ɐ̃
^chifre$	ʃ i f ɾ ɨ
^fortaleza$	f o ɾ t ɐ l ɛ z ɐ
^isca$	i ʃ k ɐ
^barro$	b a ʁ u
^aprender$	ɐ p ɾ ẽ d e ɾ
^lago$	l a ɡ u
^muitos$	m ũ j t u ʃ
^brincar$	b ɾ ĩ k a ɾ
^jejuar$	ʒ ɨ ʒ w a ɾ
^galho$	ɡ a ʎ u
^camundongo$	k ɐ m ũ d õ ɡ u
^somente$	s u m ẽ t ɨ
^gafanhoto$	ɡ ɐ f ɐ ɲ ɔ t u
^nenê$	n ɨ n e
^frango$	f ɾ ɐ̃ ɡ u
^extinguir$	i ʃ t ĩ ɡ i ɾ
^filhos$	f i ʎ u ʃ
^ter_relações_sexuais$	t e ɾ + ʁ ɨ l ɐ s õĩ ʃ + s ɨ k s w ai ʃ
^estafado$	ʃ t ɐ f a d u
^longe$	l õ ʒ ɨ
^peito$	p ɐi t u
^soluço$	s u l u s u
^uma$	u m ɐ
^cidade$	s i d a d ɨ
^susto$	s u ʃ t u
^atacar$	ɐ t ɐ k a ɾ
^ovo$	ɔ v u
^corda$	k ɔ ɾ d ɐ
^pulmão$	p u ɫ m ɐ̃ũ
^ilha$	i ʎ ɐ
^levantar$	l ɨ v ɐ̃ t a ɾ
^ceia$	s ɐi ɐ
^caracol$	k ɐ ɾ ɐ k ɔ ɫ
^seio$	s ɐi u
^assar$	ɐ s a ɾ
^orelha$	o ɾ ɐ ʎ ɐ
^vergonha$	v ɨ ɾ ɡ ɔ ɲ ɐ
^direito$	d i ɾ ɐi t u
^gamela$	ɡ ɐ m ɛ l ɐ
^garganta$	ɡ ɐ ɾ ɡ ɐ̃ t ɐ
^imposto$	ĩ p o ʃ t u
^semente$	s ɨ m ẽ t ɨ
^lodo$	l ɔ d u
^conservar$	k õ s ɨ ɾ v a ɾ
^casa_de_reunião$	k a z ɐ + d ɨ + ʁ eu n i ɐ̃ũ
^calhau$	k ɐ ʎ au
^conta$	k õ t ɐ
^agora$	ɐ ɡ ɔ ɾ ɐ
^sal$	s a ɫ
^tomar_banho$	t u m a ɾ + b ɐ ɲ u
^negociante$	n ɨ ɡ u s j ɐ̃ t ɨ
^súdito$	s u d i t u
^armas$	a ɾ m ɐ ʃ
^esticar$	ʃ t i k a ɾ
^jactar-se$	ʒ ɐ k t a ɾ s ɨ
^elevado$	i l ɨ v a d u
^nadar$	n ɐ d a ɾ
^doce$	d ɔ s ɨ
^furúnculo$	f u ɾ ũ k u l u
^em_cima$	ɐ̃ĩ + s i m ɐ
^contente$	k õ t ẽ t ɨ
^pêlo$	p e l u
^soltar$	s ɔ ɫ t a ɾ
^caspa$	k a ʃ p ɐ
^sair$	s ɐ i ɾ
^esposa$	ʃ p ɔ z ɐ
^liso$	l i z u
^madrasta$	m ɐ d ɾ a ʃ t ɐ
^resfriado$	ʁ ɨ ʃ f ɾ j a d u
^escorpião$	ʃ k u ɾ p i ɐ̃ũ
^sonhar$	s u ɲ a ɾ
^segunda-feira$	s ɨ ɡ ũ d ɐ f ɐi ɾ ɐ
^escolher$	ʃ k u ʎ e ɾ
^guardar$	ɡ w ɐ ɾ d a ɾ
^enterrar$	ẽ t ɨ ʁ a ɾ
^névoa$	n ɛ v u ɐ
^devolver$	d ɨ v ɔ ɫ v e ɾ
^cacho$	k a ʃ u
^papel$	p ɐ p ɛ ɫ
^sarigüê$	s ɐ ɾ i ɡ e
^gemer$	ʒ ɨ m e ɾ
^preamar$	p ɾ i ɐ m a ɾ
^anca$	ɐ̃ k ɐ
^chapinhar$	ʃ ɐ p i ɲ a ɾ
^armar_uma_cilada$	ɐ ɾ m a ɾ + u m ɐ + s i l a d ɐ
^gado$	ɡ a d u
^não$	n ɐ̃ũ
^levar_no_ombro$	l ɨ v a ɾ + n u + õ b ɾ u
^órfã$	ɔ ɾ f ɐ̃
^égua$	ɛ ɡ w ɐ
^ungüento$	ũ ɡ ẽ t u
^medicamento$	m ɨ d i k ɐ m ẽ t u
^amarrar$	ɐ m ɐ ʁ a ɾ
^canoa$	k ɐ n o ɐ
^atrasar$	ɐ t ɾ ɐ z a ɾ
^estragar$	ʃ t ɾ ɐ ɡ a ɾ
^quatro$	k w a t ɾ u
^pistola$	p i ʃ t ɔ l ɐ
^durar$	d u ɾ a ɾ
^domingo$	d u m ĩ ɡ u
^qual$	k w a ɫ
^explicar$	i ʃ p l i k a ɾ
^tigela$	t i ʒ ɛ l ɐ
^partir$	p ɐ ɾ t i ɾ
^danificar$	d ɐ n i f i k a ɾ
^tentar$	t ẽ t a ɾ
^aproximar$	ɐ p ɾ u s i m a ɾ
^galinha$	ɡ ɐ l i ɲ ɐ
^defecar$	d ɨ f ɨ k a ɾ
^levar_debaixo_do_braço$	l ɨ v a ɾ + d ɨ b ai ʃ u + d u + b ɾ a s u
^telhado$	t ɨ ʎ a d u
^calma$	k a ɫ m ɐ
^crer$	k ɾ e ɾ
^feio$	f ɐi u
^camelo$	k ɐ m ɛ l u
^dez$	d ɛ ʃ
^pente$	p ẽ t ɨ
^pestana$	p ɨ ʃ t ɐ n ɐ
^sabor$	s ɐ b ɔ ɾ
^arrastar-se$	ɐ ʁ ɐ ʃ t a ɾ s ɨ
^rabo$	ʁ a b u
^matar$	m ɐ t a ɾ
^casaco$	k ɐ z a k u
^nome$	n ɔ m ɨ
^fazer$	f ɐ z e ɾ
^lavar$	l ɐ v a ɾ
^conceber$	k õ s ɨ b e ɾ
^masculino$	m ɐ ʃ k u l i n u
^moer$	m u e ɾ
^ferida$	f ɨ ɾ i d ɐ
^grão$	ɡ ɾ ɐ̃ũ
^cinzel$	s ĩ z ɛ ɫ
^incendiar$	ĩ s ẽ d j a ɾ
^dançar$	d ɐ̃ s a ɾ
^pagar$	p ɐ ɡ a ɾ
^segar$	s ɨ ɡ a ɾ
^boca$	b ɔ k ɐ
^fundir$	f ũ d i ɾ
^sul$	s u ɫ
^maré_vazia$	m ɐ ɾ ɛ + v ɐ z i ɐ
^fêmea$	f e m i ɐ
^comprar$	k õ p ɾ a ɾ
^frio$	f ɾ j ɔ
^grande$	ɡ ɾ ɐ̃ d ɨ
^barco$	b a ɾ k u
^bengala$	b ɐ̃ĩ ɡ a l ɐ
^colmeia$	k ɔ ɫ m ɐi ɐ
^inchação$	ĩ ʃ ɐ s ɐ̃ũ
^terceiro$	t ɨ ɾ s ɐi ɾ u
^cochichar$	k u ʃ i ʃ a ɾ
^miolos$	m j ɔ l u ʃ
^faca$	f a k ɐ
^rei$	ʁ ɐi
^castigo$	k ɐ ʃ t i ɡ u
^bater_com_o_punho$	b ɐ t e ɾ + k õ + u + p u ɲ u
^bigorna$	b i ɡ ɔ ɾ n ɐ
^pronto$	p ɾ õ t u
^provar$	p ɾ u v a ɾ
^hoje$	ɔ ʒ ɨ
^chumbo$	ʃ ũ b u
^tecer$	t ɨ s e ɾ
^comichão$	k u m i ʃ ɐ̃ũ
^nove$	n ɔ v ɨ
^canhão$	k ɐ ɲ ɐ̃ũ
^cerveja$	s ɨ ɾ v ɐ ʒ ɐ
^costurar$	k u ʃ t u ɾ a ɾ
^inferno$	ĩ f ɛ ɾ n u
^outono$	o t ɔ n u
^animal$	ɐ n i m a ɫ
^costume$	k u ʃ t u m ɨ
^chama$	ʃ ɐ m ɐ
^correto$	k u ʁ ɛ t u
^dono$	d ɔ n u
^arraia$	ɐ ʁ ai ɐ
^incêndio_culposo$	ĩ s ẽ d j u + k u ɫ p ɔ z u
^milho$	m i ʎ u
^trabalhar$	t ɾ ɐ b ɐ ʎ a ɾ
^vara$	v a ɾ ɐ
^jugo$	ʒ u ɡ u
^direita$	d i ɾ ɐi t ɐ
^espuma$	ʃ p u m ɐ
^corneta$	k u ɾ n ɛ t ɐ
^onze$	õ z ɨ
^duas$	d w a ʃ
^guizo$	ɡ i z u
^segredo$	s ɨ ɡ ɾ ɛ d u
^abençoar$	ɐ b ɐ̃ĩ s u a ɾ
^cansado$	k ɐ̃ s a d u
^panela$	p ɐ n ɛ l ɐ
^fora$	f ɔ ɾ ɐ
^depois_de_amanhã$	d ɨ p oi ʒ + d ɨ + ɐ m ɐ ɲ ɐ̃
^trave$	t ɾ a v ɨ
^anfitrião$	ɐ̃ f i t ɾ i ɐ̃ũ
^metade$	m ɨ t a d ɨ
^salvar$	s a ɫ v a ɾ
^cobiçoso$	k u b i s ɔ z u
^pão$	p ɐ̃ũ
^raso$	ʁ a z u
^agachar-se$	ɐ ɡ ɐ ʃ a ɾ s ɨ
^erro$	ɛ ʁ u
^acreditar$	ɐ k ɾ ɨ d i t a ɾ
^porque$	p u ɾ k w ɨ
^errar$	i ʁ a ɾ
^praiamar$	p ɾ ɐi ɐ m a ɾ
^construir$	k õ ʃ t ɾ ui ɾ
^dia$	d i ɐ
^ordenhar$	o ɾ d ɨ ɲ a ɾ
^deixar$	d ɐi ʃ a ɾ
^convidado$	k õ v i d a d u
^fruta$	f ɾ u t ɐ
^cortar$	k o ɾ t a ɾ
^bétula$	b ɛ t u l ɐ
^pomba$	p õ b ɐ
^avarento$	ɐ v ɐ ɾ ẽ t u
^pescador$	p ɨ ʃ k ɐ d o ɾ
^país$	p ɐ i ʃ
^pirilampo$	p i ɾ i l ɐ̃ p u
^acusado$	ɐ k u z a d u
^escama$	ʃ k ɐ m ɐ
^tempestuoso$	t ẽ p ɨ ʃ t u ɔ z u
^correr$	k u ʁ e ɾ
^praia$	p ɾ ai ɐ
^oeste$	o e ʃ t ɨ
^lóbulo$	l ɔ b u l u
^papagaio$	p ɐ p ɐ ɡ ai u
^virar$	v i ɾ a ɾ
^canto$	k ɐ̃ t u
^açúcar$	ɐ s u k ɐ ɾ
^jardim$	ʒ ɐ ɾ d ĩ
^farinha$	f ɐ ɾ i ɲ ɐ
^quadril$	k w ɐ d ɾ i ɫ
^em_breve$	ɐ̃ĩ + b ɾ ɛ v ɨ
^corante$	k u ɾ ɐ̃ t ɨ
^ferimento$	f ɨ ɾ i m ẽ t u
^tempestade$	t ẽ p ɨ ʃ t a d ɨ
^mão_de_pilão$	m ɐ̃ũ + d ɨ + p i l ɐ̃ũ
