ID	DOCULECT	CONCEPT	VALUE	FORM	TOKENS	NOTE	BORROWED	BORROWED_SCORE	BORROWED_BASE
10152	Otomi	DEMON	zunthu	zunthu	z u n θ u		5. no evidence for borrowing	0.0	
10153	Otomi	DEMON	dämänts'o	dämänts'o	d ɐ m ɐ n tsʼ o		5. no evidence for borrowing	0.0	
10154	Otomi	DEMON	nts'o	nts'o	n tsʼ o		5. no evidence for borrowing	0.0	
11316	ImbaburaQuechua	DEMON	aya	aya	a j a		5. no evidence for borrowing	0.0	
1491	Portuguese	DENY	negar	negar	n ɨ ɡ a ɾ				
3255	Spanish	DENY	negar	negar	n e ɣ a ɾ				
4740	Yaqui	DENY	nekaroa	nekaroa	n e k a r o a		1. clearly borrowed	1.0	
4741	Yaqui	DENY	kaa a mabeta	kaa_a_mabeta	k aː + a + m a b e t a		5. no evidence for borrowing	0.0	
6045	ZinacantanTzotzil	DENY	halan	halan	h a l a n		5. no evidence for borrowing	0.0	
7750	Qeqchi	DENY	jalmuqank, jalmuqink	jalmuqank	x a l m u q a n kʰ		5. no evidence for borrowing	0.0	
9890	Otomi	DENY	ko̲ni	ko̲ni	k ə n i		5. no evidence for borrowing	0.0	
11210	ImbaburaQuechua	DENY	mana nina	mana_nina	m a n a + n i n a		5. no evidence for borrowing	0.0	
161	Portuguese	DESCENDANTS	descendentes	descendentes	d ɨ ʃ s ẽ d ẽ t ɨ ʃ				
1840	Spanish	DESCENDANTS	descendientes	descendientes	d e s e n d j e n t e s				
3595	Yaqui	DESCENDANTS	chukula katriam	chukula_katriam	tʃ u k u l a + k a t r i a m		5. no evidence for borrowing	0.0	
3596	Yaqui	DESCENDANTS	basiulam	basiulam	b a s i u l a m		5. no evidence for borrowing	0.0	
6296	Qeqchi	DESCENDANTS	ralal xk’ajol	ralal_xk’ajol	r a l a l + ʃ kʼ a x o l		5. no evidence for borrowing	0.0	
8091	Otomi	DESCENDANTS	ya bätsi ne ya 'be̲to	ya_bätsi_ne_ya_'be̲to	j a + b ɐ ts i + n e + j a + ˀb æ t̪ o		5. no evidence for borrowing	0.0	
10274	ImbaburaQuechua	DESCENDANTS	churikuna	churikuna	tʃ u ɾ i k u n a		5. no evidence for borrowing	0.0	
1026	Portuguese	DESTROY	destruir	destruir	d ɨ ʃ t ɾ ui ɾ				
2749	Spanish	DESTROY	destruir	destruir	d ɛ s t ɾ w i ɾ				
4332	Yaqui	DESTROY	mojakta	mojakta	m o j a k t a		5. no evidence for borrowing	0.0	
7205	Qeqchi	DESTROY	juk'uk	juk'uk	x u kʼ u kʰ		5. no evidence for borrowing	0.0	
7206	Qeqchi	DESTROY	sachok	sachok	s a tʃ o kʰ		5. no evidence for borrowing	0.0	
7207	Qeqchi	DESTROY	po’ok	po’ok	p o ʔ o kʰ		5. no evidence for borrowing	0.0	
9224	Otomi	DESTROY	xa̲ni	xa̲ni	x ɔ n i		5. no evidence for borrowing	0.0	
9225	Otomi	DESTROY	ts'oni	ts'oni	ts ʔ o n i		5. no evidence for borrowing	0.0	
9226	Otomi	DESTROY	yo̲t'e	yo̲t'e	j ə t̪ʼ e		5. no evidence for borrowing	0.0	
10862	ImbaburaQuechua	DESTROY	waglichina	waglichina	w a g l i tʃ i n a		5. no evidence for borrowing	0.0	
75	Portuguese	DEW	orvalho	orvalho	o ɾ v a ʎ u				
1756	Spanish	DEW	rocío	rocío	r o θ i o				
3506	Yaqui	DEW	siijo’ote	siijo’ote	s iː j o ʔ o t e		5. no evidence for borrowing	0.0	
4943	ZinacantanTzotzil	DEW	7ov 7osil	7ov_7osil	ʔ o v + ʔ o s i l		5. no evidence for borrowing	0.0	
6208	Qeqchi	DEW	k’ajob’	k’ajob’	kʼ a x o ɓ		5. no evidence for borrowing	0.0	
6209	Qeqchi	DEW	chu’ke	chu’ke	tʃ u ʔ k e		5. no evidence for borrowing	0.0	
7992	Otomi	DEW	xa (1)	xa	x a		5. no evidence for borrowing	0.0	
10208	ImbaburaQuechua	DEW	yaku wiki	yaku_wiki	j a k u + w i k i		5. no evidence for borrowing	0.0	
1448	Portuguese	DIFFICULT	difícil	difícil	d i f i s i ɫ				
3205	Spanish	DIFFICULT	difícil	difícil	d i f i θ i l				
4699	Yaqui	DIFFICULT	obiachi	obiachi	o b i a tʃ i		5. no evidence for borrowing	0.0	
6006	ZinacantanTzotzil	DIFFICULT	vokol	vokol	v o k o l		5. no evidence for borrowing	0.0	
7704	Qeqchi	DIFFICULT	ch'a'aj	ch'a'aj	tʃʼ a ʔ a x		5. no evidence for borrowing	0.0	
9805	Otomi	DIFFICULT	xi hñei	xi_hñei	x i + h ɲ e i		5. no evidence for borrowing	0.0	
9806	Otomi	DIFFICULT	xi hñembi	xi_hñembi	x i + h ɲ e m b i		5. no evidence for borrowing	0.0	
11172	ImbaburaQuechua	DIFFICULT	sinchi	sinchi	s i n dʒ i		5. no evidence for borrowing	0.0	
747	Portuguese	DIG	cavar; escavar	cavar	k ɐ v a ɾ				
748	Portuguese	DIG	cavar; escavar	escavar	ʃ k ɐ v a ɾ				
2441	Spanish	DIG	excavar; cavar	excavar	ɛ s k a β a ɾ				
2442	Spanish	DIG	excavar; cavar	cavar	k a β a ɾ				
4097	Yaqui	DIG	ji’ibweje	ji’ibweje	j i ʔ i bʷ e j e		5. no evidence for borrowing	0.0	
5486	ZinacantanTzotzil	DIG	ch’oh	ch’oh	tʃʼ o h		5. no evidence for borrowing	0.0	
5487	ZinacantanTzotzil	DIG	hok’	hok’	h o kʼ		5. no evidence for borrowing	0.0	
6892	Qeqchi	DIG	pikok	pikok	p i k o kʰ		2. probably borrowed	0.75	
6893	Qeqchi	DIG	aq'ink	aq'ink	a qʼ i n kʰ		5. no evidence for borrowing	0.0	
6894	Qeqchi	DIG	b'ekok	b'ekok	ɓ e k o kʰ		5. no evidence for borrowing	0.0	
8799	Otomi	DIG	he̲t'i	he̲t'i	h æ t̪ʼ i		5. no evidence for borrowing	0.0	
8800	Otomi	DIG	he̲ki	he̲ki	h æ k i		5. no evidence for borrowing	0.0	
8801	Otomi	DIG	o̲t'u̲'ñuthe	o̲t'u̲'ñuthe	ə t̪ʼ u ˀɲ u θ e		5. no evidence for borrowing	0.0	
10680	ImbaburaQuechua	DIG	allana	allana	a ʒ a n a		5. no evidence for borrowing	0.0	
548	Portuguese	DINNER (SUPPER)	jantar	jantar	ʒ ɐ̃ t a ɾ				
549	Portuguese	DINNER (SUPPER)	jantar; ceia	jantar	ʒ ɐ̃ t a ɾ				
550	Portuguese	DINNER (SUPPER)	jantar; ceia	ceia	s ɐi ɐ				
2244	Spanish	DINNER (SUPPER)	comida	comida	k o m i ð a				
2245	Spanish	DINNER (SUPPER)	cena	cena	θ e n a				
3927	Yaqui	DINNER (SUPPER)	luula katek bwa’ame	luula_katek_bwa’ame	l uː l a + k a t e k + bʷ a ʔ a m e		5. no evidence for borrowing	0.0	
3928	Yaqui	DINNER (SUPPER)	kupteo bwa’ame	kupteo_bwa’ame	k u p t e o + bʷ a ʔ a m e		5. no evidence for borrowing	0.0	
3929	Yaqui	DINNER (SUPPER)	kaa machiak bwa’ame	kaa_machiak_bwa’ame	k aː + m a tʃ i a k + bʷ a ʔ a m e		5. no evidence for borrowing	0.0	
6704	Qeqchi	DINNER (SUPPER)	wa	wa	w a		5. no evidence for borrowing	0.0	
6705	Qeqchi	DINNER (SUPPER)	wa	wa	w a		5. no evidence for borrowing	0.0	
6706	Qeqchi	DINNER (SUPPER)	wa re ewu	wa_re_ewu	w a + ɾ e + e w u		5. no evidence for borrowing	0.0	
8567	Otomi	DINNER (SUPPER)	nts’i	nts’i	n tsʼ i		5. no evidence for borrowing	0.0	
8568	Otomi	DINNER (SUPPER)	hñuni	hñuni	h ɲ u n i		5. no evidence for borrowing	0.0	
8569	Otomi	DINNER (SUPPER)	nt'oxi	nt'oxi	n t̪ʼ o x i		5. no evidence for borrowing	0.0	
10551	ImbaburaQuechua	DINNER (SUPPER)	sina	sina	s i n a		1. clearly borrowed	1.0	
10552	ImbaburaQuechua	DINNER (SUPPER)	sina	sina	s i n a		1. clearly borrowed	1.0	
1341	Portuguese	DIRTY	sujo	sujo	s u ʒ u				
3082	Spanish	DIRTY	sucio	sucio	s u θ j o				
4613	Yaqui	DIRTY	jaiti maachi	jaiti_maachi	j a i t i + m aː tʃ i		5. no evidence for borrowing	0.0	
5929	ZinacantanTzotzil	DIRTY	7ik’ (3)	7ik’	ʔ i kʼ		5. no evidence for borrowing	0.0	
7592	Qeqchi	DIRTY	b'alak'	b'alak'	ɓ a l a kʼ		5. no evidence for borrowing	0.0	
7593	Qeqchi	DIRTY	b'ulux, b’alux	b'ulux	ɓ u l u ʃ		5. no evidence for borrowing	0.0	
7594	Qeqchi	DIRTY	pes	pes	p e s		5. no evidence for borrowing	0.0	
7595	Qeqchi	DIRTY	tz'aj, tz'ajn	tz'aj	tsʼ a x		5. no evidence for borrowing	0.0	
7596	Qeqchi	DIRTY	yib'ob'aal ru	yib'ob'aal_ru	j i ɓ o ɓ aː l + ɾ u		5. no evidence for borrowing	0.0	
9647	Otomi	DIRTY	xi nts'o	xi_nts'o	x i + n tsʼ o		5. no evidence for borrowing	0.0	
11094	ImbaburaQuechua	DIRTY	mapa	mapa	m a p a		5. no evidence for borrowing	0.0	
962	Portuguese	DISAPPEAR	desaparecer	desaparecer	d ɨ z ɐ p ɐ ɾ ɨ s e ɾ				
2678	Spanish	DISAPPEAR	desaparecer	desaparecer	d e s a p a ɾ e θ ɛ ɾ				
4274	Yaqui	DISAPPEAR	lu’ute	lu’ute	l u ʔ u t e		5. no evidence for borrowing	0.0	
5646	ZinacantanTzotzil	DISAPPEAR	sakch’ay	sakch’ay	s a k tʃʼ a j		5. no evidence for borrowing	0.0	
7136	Qeqchi	DISAPPEAR	muqunk	muqunk	m u q u n kʰ		5. no evidence for borrowing	0.0	
9129	Otomi	DISAPPEAR	‘bedi	‘bedi	ˀb e d i		5. no evidence for borrowing	0.0	
10823	ImbaburaQuechua	DISAPPEAR	chingana (2)	chingana	tʃ i ŋ g a n a		5. no evidence for borrowing	0.0	
531	Portuguese	DISH	prato	prato	p ɾ a t u				
2228	Spanish	DISH	plato; fuente	plato	p l a t o				
2229	Spanish	DISH	plato; fuente	fuente	f w e n t e				
3913	Yaqui	DISH	pu’ato	pu’ato	p u ʔ a t o		1. clearly borrowed	1.0	
6683	Qeqchi	DISH	sek’	sek’	s e kʼ		2. probably borrowed	0.75	
8551	Otomi	DISH	mohi	mohi	m o h i		5. no evidence for borrowing	0.0	
10539	ImbaburaQuechua	DISH	platu	platu	p l a t u		1. clearly borrowed	1.0	
742	Portuguese	DITCH	fosso; canal; vala	fosso	f ɔ s u				
743	Portuguese	DITCH	fosso; canal; vala	canal	k ɐ n a ɫ				
744	Portuguese	DITCH	fosso; canal; vala	vala	v a l ɐ				
2437	Spanish	DITCH	zanja; canal	zanja	θ a n x a				
2438	Spanish	DITCH	zanja; canal	canal	k a n a l				
4094	Yaqui	DITCH	sanja	sanja	s a n j a		1. clearly borrowed	1.0	
5484	ZinacantanTzotzil	DITCH	beo7	beo7	ɓ e o ʔ		5. no evidence for borrowing	0.0	
6886	Qeqchi	DITCH	roq ha’	roq_ha’	r o q + h a ʔ		5. no evidence for borrowing	0.0	
6887	Qeqchi	DITCH	jul	jul	x u l		5. no evidence for borrowing	0.0	
8794	Otomi	DITCH	'ñuthe	'ñuthe	ˀɲ u θ e		5. no evidence for borrowing	0.0	
10677	ImbaburaQuechua	DITCH	sanja	sanja	s a n x a		1. clearly borrowed	1.0	
932	Portuguese	DIVE	mergulhar	mergulhar	m ɨ ɾ ɡ u ʎ a ɾ				
2648	Spanish	DIVE	zambullirse	zambullirse	θ a m b u ʎ i ɾ s e				
4243	Yaqui	DIVE	ropte	ropte	r o p t e		5. no evidence for borrowing	0.0	
7102	Qeqchi	DIVE	muqa’alik	muqa’alik	m u q a ʔ a l i kʰ		5. no evidence for borrowing	0.0	
9089	Otomi	DIVE	ku̲i	ku̲i	k u i		5. no evidence for borrowing	0.0	
9090	Otomi	DIVE	nku̲'mi jar dehe	nku̲'mi_jar_dehe	n k u ˀm i + x a r + d e h e		5. no evidence for borrowing	0.0	
9091	Otomi	DIVE	nku̲'mu̲dehe	nku̲'mu̲dehe	n k u ˀm u d e h e		5. no evidence for borrowing	0.0	
1095	Portuguese	DIVIDE	dividir	dividir	d i v i d i ɾ				
2829	Spanish	DIVIDE	dividir	dividir	d i β i ð i ɾ				
4389	Yaqui	DIVIDE	na’ikimte	na’ikimte	n a ʔ i k i m t e		5. no evidence for borrowing	0.0	
5735	ZinacantanTzotzil	DIVIDE	ch’ak	ch’ak	tʃʼ a k		5. no evidence for borrowing	0.0	
7283	Qeqchi	DIVIDE	jachink	jachink	x a tʃ i n kʰ		5. no evidence for borrowing	0.0	
9317	Otomi	DIVIDE	heke	heke	h e k e		5. no evidence for borrowing	0.0	
10913	ImbaburaQuechua	DIVIDE	partina	partina	p a ɾ t i n a		1. clearly borrowed	1.0	
124	Portuguese	DIVORCE	divórcio	divórcio	d i v ɔ ɾ s j u				
1801	Spanish	DIVORCE	divorcio	divorcio	d i β o ɾ θ j o				
3543	Yaqui	DIVORCE	su’utojiwame	su’utojiwame	s u ʔ u t o j i w a m e		5. no evidence for borrowing	0.0	
4981	ZinacantanTzotzil	DIVORCE	7iktaehbail	7iktaehbail	ʔ i k t a e h ɓ a i l		5. no evidence for borrowing	0.0	
4982	ZinacantanTzotzil	DIVORCE	ch’akbail	ch’akbail	tʃʼ a k ɓ a i l		5. no evidence for borrowing	0.0	
6255	Qeqchi	DIVORCE	jachoj ib’	jachoj_ib’	x a tʃ o x + i ɓ		5. no evidence for borrowing	0.0	
8037	Otomi	DIVORCE	nthe̲ku̲nthäti	nthe̲ku̲nthäti	n θ æ k u n θ ɐ t̪ i		5. no evidence for borrowing	0.0	
8038	Otomi	DIVORCE	thekunthäti	thekunthäti	θ e k u n θ ɐ t̪ i		5. no evidence for borrowing	0.0	
10242	ImbaburaQuechua	DIVORCE	dibursyu	dibursyu	d i b u ɾ s j u		1. clearly borrowed	1.0	
816	Portuguese	DO OR MAKE	fazer	fazer	f ɐ z e ɾ				
2521	Spanish	DO OR MAKE	hacer	hacer	a θ ɛ ɾ				
248	Portuguese	DOG	cão; cachorro	cão	k ɐ̃ũ				
249	Portuguese	DOG	cão; cachorro	cachorro	k ɐ ʃ ɔ ʁ u				
1944	Spanish	DOG	perro	perro	p ɛ r o				
3669	Yaqui	DOG	chuu’u	chuu’u	tʃ uː ʔ u		5. no evidence for borrowing	0.0	
5080	ZinacantanTzotzil	DOG	tz’i7	tz’i7	tsʼ i ʔ		5. no evidence for borrowing	0.0	
6384	Qeqchi	DOG	tz’i’	tz’i’	tsʼ i ʔ		5. no evidence for borrowing	0.0	
8233	Otomi	DOG	tsat'yo	tsat'yo	ts a t̪ʼ j o		5. no evidence for borrowing	0.0	
8234	Otomi	DOG	txu̲ku̲	txu̲ku̲	t̪ x u k u		5. no evidence for borrowing	0.0	
8235	Otomi	DOG	ndo̲'yo	ndo̲'yo	n d ə ˀj o		5. no evidence for borrowing	0.0	
8236	Otomi	DOG	tsu'yo (2)	tsu'yo	ts u ˀj o		5. no evidence for borrowing	0.0	
8237	Otomi	DOG	'yo (1)	'yo	ˀj o		5. no evidence for borrowing	0.0	
10342	ImbaburaQuechua	DOG	allku	allku	a ʒ k u		5. no evidence for borrowing	0.0	
264	Portuguese	DOLPHIN	delfim; golfinho	delfim	d ɛ ɫ f ĩ				
265	Portuguese	DOLPHIN	delfim; golfinho	golfinho	ɡ ɔ ɫ f i ɲ u				
1957	Spanish	DOLPHIN	delfín	delfín	d ɛ l f i n				
3553	Yaqui	DOLPHIN	relpin	relpin	r e l p i n		1. clearly borrowed	1.0	
8050	Otomi	DOLPHIN	delfin	delfin	d e l f i n		1. clearly borrowed	1.0	
223	Portuguese	DONKEY	asno; burro	asno	a ʒ n u				
224	Portuguese	DONKEY	asno; burro	burro	b u ʁ u				
1917	Spanish	DONKEY	asno; burro	asno	a s n o				
1918	Spanish	DONKEY	asno; burro	burro	b u r o				
3649	Yaqui	DONKEY	buuru	buuru	b uː r u		1. clearly borrowed	1.0	
5058	ZinacantanTzotzil	DONKEY	buro	buro	ɓ u ɾ o		1. clearly borrowed	1.0	
6360	Qeqchi	DONKEY	b’uro, b’uur	b’uro	ɓ u ɾ o		1. clearly borrowed	1.0	
8205	Otomi	DONKEY	burru	burru	b u r r u		1. clearly borrowed	1.0	
8206	Otomi	DONKEY	ndo̲bru	ndo̲bru	n d ə b r u		1. clearly borrowed	1.0	
8207	Otomi	DONKEY	tsubru	tsubru	ts u b r u		1. clearly borrowed	1.0	
10324	ImbaburaQuechua	DONKEY	burru	burru	b u ʐ u		1. clearly borrowed	1.0	
689	Portuguese	DOOR	porta; portão	porta	p ɔ ɾ t ɐ				
690	Portuguese	DOOR	porta; portão	portão	p o ɾ t ɐ̃ũ				
2386	Spanish	DOOR	puerta	puerta	p w ɛ ɾ t a				
4057	Yaqui	DOOR	pueta	pueta	p u e t a		1. clearly borrowed	1.0	
5446	ZinacantanTzotzil	DOOR	mak na	mak_na	m a k + n a		5. no evidence for borrowing	0.0	
5447	ZinacantanTzotzil	DOOR	mak ti7 na	mak_ti7_na	m a k + t i ʔ + n a		5. no evidence for borrowing	0.0	
5448	ZinacantanTzotzil	DOOR	ti7 na	ti7_na	t i ʔ + n a		5. no evidence for borrowing	0.0	
6835	Qeqchi	DOOR	okeb’al	okeb’al	o k e ɓ a l		5. no evidence for borrowing	0.0	
6836	Qeqchi	DOOR	re kab’	re_kab’	r e + k a ɓ		5. no evidence for borrowing	0.0	
6837	Qeqchi	DOOR	pwerta	pwerta	p w e ɾ t a		1. clearly borrowed	1.0	
8733	Otomi	DOOR	goxthi	goxthi	g o x θ i		5. no evidence for borrowing	0.0	
10647	ImbaburaQuechua	DOOR	pungu	pungu	p u ŋ g u		5. no evidence for borrowing	0.0	
691	Portuguese	DOORPOST	umbral; ombreira da porta	umbral	ũ b ɾ a ɫ				
692	Portuguese	DOORPOST	umbral; ombreira da porta	ombreira da porta	<<o>> <<m>> <<b>> <<r>> <<e>> <<i>> <<r>> <<a>> + <<d>> <<a>> + <<p>> <<o>> <<r>> <<t>> <<a>>				
2387	Spanish	DOORPOST	jamba de puerta; larguero	jamba de puerta	<<j>> <<a>> <<m>> <<b>> <<a>> + <<d>> <<e>> + <<p>> <<u>> <<e>> <<r>> <<t>> <<a>>				
2388	Spanish	DOORPOST	jamba de puerta; larguero	larguero	l a ɾ ɣ ɛ ɾ o				
4058	Yaqui	DOORPOST	marko	marko	m a r k o		1. clearly borrowed	1.0	
4059	Yaqui	DOORPOST	pueta mayoa	pueta_mayoa	p u e t a + m a j o a		5. no evidence for borrowing	0.0	pueta = Spanish ‘puerta’ plus Yaqui mayoa ‘edge’.
6838	Qeqchi	DOORPOST	champa	champa	tʃ a m p a		1. clearly borrowed	1.0	
8734	Otomi	DOORPOST	’mai goxthi	’mai_goxthi	ʔ m a i + g o x θ i		5. no evidence for borrowing	0.0	
8735	Otomi	DOORPOST	poste	poste	p o s t̪ e		1. clearly borrowed	1.0	
1442	Portuguese	DOUBT	duvidar	duvidar	d u v i d a ɾ				
3200	Spanish	DOUBT	dudar	dudar	d u ð a ɾ				
4694	Yaqui	DOUBT	dudaroa ~ ruraroa	dudaroa	d u d a r o a		1. clearly borrowed	1.0	-oa = Nahuatl verbalizer suffix
7699	Qeqchi	DOUBT	kiib'ank ch'ool	kiib'ank_ch'ool	k iː ɓ a n k + tʃʼ oː l		5. no evidence for borrowing	0.0	
9795	Otomi	DOUBT	ntso̲'mi	ntso̲'mi	n ts ə ˀm i		5. no evidence for borrowing	0.0	
11168	ImbaburaQuechua	DOUBT	nakrina	nakrina	n a k ɾ i n a		5. no evidence for borrowing	0.0	Clearly created on loan basis
559	Portuguese	DOUGH	massa	massa	m a s ɐ				
2255	Spanish	DOUGH	masa	masa	m a s a				
3935	Yaqui	DOUGH	kittim	kittim	k i t t i m		5. no evidence for borrowing	0.0	
5355	ZinacantanTzotzil	DOUGH	puk'	puk'	pʰ u k ʔ		5. no evidence for borrowing	0.0	
6718	Qeqchi	DOUGH	q’em	q’em	q ʔ e m		5. no evidence for borrowing	0.0	
8579	Otomi	DOUGH	ju̲ní hogu̲t'e̲i	ju̲ní_hogu̲t'e̲i	x u n i + h o g u t̪ʼ æ i		5. no evidence for borrowing	0.0	
8580	Otomi	DOUGH	ju̲ní trigo	ju̲ní_trigo	x u n i + t̪ r i g o		1. clearly borrowed	1.0	
8581	Otomi	DOUGH	ju̲ní de̲thä	ju̲ní_de̲thä	x u n i + d æ θ ɐ		5. no evidence for borrowing	0.0	
10558	ImbaburaQuechua	DOUGH	masa	masa	m a s a		1. clearly borrowed	1.0	
245	Portuguese	DOVE	pomba	pomba	p õ b ɐ				
1941	Spanish	DOVE	paloma	paloma	p a l o m a				
3667	Yaqui	DOVE	wokkoi	wokkoi	w o k k o i		5. no evidence for borrowing	0.0	
5076	ZinacantanTzotzil	DOVE	pulivok	pulivok	pʰ u l i v o k		5. no evidence for borrowing	0.0	
5077	ZinacantanTzotzil	DOVE	tzuin	tzuin	tsʰ u i n		5. no evidence for borrowing	0.0	
6381	Qeqchi	DOVE	mukuy	mukuy	m u k u j		2. probably borrowed	0.75	
8229	Otomi	DOVE	palomä	palomä	p a l o m ɐ		1. clearly borrowed	1.0	
10340	ImbaburaQuechua	DOVE	paluma	paluma	p a l u m a		1. clearly borrowed	1.0	
1069	Portuguese	DOWN OR BELOW	debaixo, abaixo	debaixo	d ɨ b ai ʃ u				
1070	Portuguese	DOWN OR BELOW	debaixo, abaixo	abaixo	ɐ b ai ʃ u				
2796	Spanish	DOWN OR BELOW	abajo; bajo; debajo	abajo	a β a x o				
2797	Spanish	DOWN OR BELOW	abajo; bajo; debajo	bajo	b a x o				
2798	Spanish	DOWN OR BELOW	abajo; bajo; debajo	debajo	d e β a x o				
593	Portuguese	DRAW MILK	ordenhar	ordenhar	o ɾ d ɨ ɲ a ɾ				
2285	Spanish	DRAW MILK	ordeɲar	ordeɲar	o ɾ ð e ɲ a ɾ				
3965	Yaqui	DRAW MILK	jipi’ike	jipi’ike	j i p i ʔ i k e		5. no evidence for borrowing	0.0	
5387	ZinacantanTzotzil	DRAW MILK	pitz’	pitz’	pʰ i tsʼ		5. no evidence for borrowing	0.0	
6751	Qeqchi	DRAW MILK	yatz'ok	yatz'ok	j a tsʼ o kʰ		5. no evidence for borrowing	0.0	
8613	Otomi	DRAW MILK	te̲'mi	te̲'mi	t̪ æ ˀm i		5. no evidence for borrowing	0.0	
10583	ImbaburaQuechua	DRAW MILK	chawana	chawana	tʃ a w a n a		5. no evidence for borrowing	0.0	
430	Portuguese	DREAM (SOMETHING)	sonhar	sonhar	s u ɲ a ɾ				
2125	Spanish	DREAM (SOMETHING)	soɲar	soɲar	s o ɲ a ɾ				
3833	Yaqui	DREAM (SOMETHING)	tenku	tenku	t e n k u		5. no evidence for borrowing	0.0	
5253	ZinacantanTzotzil	DREAM (SOMETHING)	vaychin	vaychin	v a j tʃʰ i n		5. no evidence for borrowing	0.0	
6585	Qeqchi	DREAM (SOMETHING)	matk'ek	matk'ek	m a t kʼ e kʰ		5. no evidence for borrowing	0.0	
6586	Qeqchi	DREAM (SOMETHING)	na' uuchik	na'_uuchik	n a ʔ + uː tʃ i kʰ		5. no evidence for borrowing	0.0	
8430	Otomi	DREAM (SOMETHING)	'wi	'wi	ˀw i		5. no evidence for borrowing	0.0	
8431	Otomi	DREAM (SOMETHING)	'withä	'withä	ˀw i θ ɐ		5. no evidence for borrowing	0.0	
10476	ImbaburaQuechua	DREAM (SOMETHING)	muskuna	muskuna	m u s k u n a		5. no evidence for borrowing	0.0	
631	Portuguese	DRESS	vestido	vestido	v ɨ ʃ t i d u				
2321	Spanish	DRESS	vestido	vestido	b ɛ s t i ð o				
4003	Yaqui	DRESS	supem	supem	s u p e m		5. no evidence for borrowing	0.0	
6784	Qeqchi	DRESS	tiqb'al	tiqb'al	t i q ɓ a l		5. no evidence for borrowing	0.0	
6785	Qeqchi	DRESS	po'ot	po'ot	p o ʔ o tʰ		5. no evidence for borrowing	0.0	
8659	Otomi	DRESS	‘bitu 'be̲hñä	‘bitu_'be̲hñä	ˀb i t̪ u + ˀb æ h ɲ ɐ		5. no evidence for borrowing	0.0	
8660	Otomi	DRESS	nthe 'be̲hñä	nthe_'be̲hñä	n θ e + ˀb æ h ɲ ɐ		5. no evidence for borrowing	0.0	
10612	ImbaburaQuechua	DRESS	anaku (1)	anaku	a n a k u		5. no evidence for borrowing	0.0	
426	Portuguese	DRIBBLE	babar	babar	b ɐ b a ɾ				
2121	Spanish	DRIBBLE	gotear; babear	gotear	g o t e a ɾ				
2122	Spanish	DRIBBLE	gotear; babear	babear	b a β e a ɾ				
3829	Yaqui	DRIBBLE	chakte	chakte	tʃ a k t e		5. no evidence for borrowing	0.0	
3830	Yaqui	DRIBBLE	chichek	chichek	tʃ i tʃ e k		5. no evidence for borrowing	0.0	
6578	Qeqchi	DRIBBLE	leeleb’ak	leeleb’ak	l eː l e ɓ a kʰ		5. no evidence for borrowing	0.0	
8426	Otomi	DRIBBLE	ju̲t'i (1)	ju̲t'i	x u t̪ʼ i		5. no evidence for borrowing	0.0	
8427	Otomi	DRIBBLE	ju̲xt'i	ju̲xt'i	x u x t̪ʼ i		5. no evidence for borrowing	0.0	
10473	ImbaburaQuechua	DRIBBLE	llaushana	llaushana	ʒ a u ʃ a n a		5. no evidence for borrowing	0.0	
509	Portuguese	DRINK	beber; tomar	beber	b ɨ b e ɾ				
510	Portuguese	DRINK	beber; tomar	tomar	t u m a ɾ				
2209	Spanish	DRINK	beber	beber	b e β ɛ ɾ				
3895	Yaqui	DRINK	je’e	je’e	j e ʔ e		5. no evidence for borrowing	0.0	
5318	ZinacantanTzotzil	DRINK	7uch’ (2)	7uch’	ʔ u tʃʼ		5. no evidence for borrowing	0.0	
6667	Qeqchi	DRINK	uk'ak	uk'ak	u kʼ a kʰ		5. no evidence for borrowing	0.0	
8521	Otomi	DRINK	tsi	tsi	ts i		5. no evidence for borrowing	0.0	
8522	Otomi	DRINK	tsithe	tsithe	ts i θ e		5. no evidence for borrowing	0.0	
8523	Otomi	DRINK	'bet'i	'bet'i	ˀb e t̪ʼ i		5. no evidence for borrowing	0.0	
10526	ImbaburaQuechua	DRINK	ufiana	ufiana	u ɸ i a n a		5. no evidence for borrowing	0.0	
920	Portuguese	DRIP (EMIT LIQUID)	gotejar; escorrer	gotejar	ɡ u t ɨ ʒ a ɾ				
921	Portuguese	DRIP (EMIT LIQUID)	gotejar; escorrer	escorrer	ʃ k u ʁ e ɾ				
2637	Spanish	DRIP (EMIT LIQUID)	gotear; escurrir	gotear	g o t e a ɾ				
2638	Spanish	DRIP (EMIT LIQUID)	gotear; escurrir	escurrir	ɛ s k u r i ɾ				
4234	Yaqui	DRIP (EMIT LIQUID)	chakte	chakte	tʃ a k t e		5. no evidence for borrowing	0.0	
5612	ZinacantanTzotzil	DRIP (EMIT LIQUID)	tz’uh	tz’uh	tsʼ u h		5. no evidence for borrowing	0.0	
7086	Qeqchi	DRIP (EMIT LIQUID)	rachrotk	rachrotk	r a tʃ ɾ o t kʰ		5. no evidence for borrowing	0.0	
7087	Qeqchi	DRIP (EMIT LIQUID)	tz'iltz'otk	tz'iltz'otk	tsʼ i l tsʼ o t kʰ		5. no evidence for borrowing	0.0	
7088	Qeqchi	DRIP (EMIT LIQUID)	tz'uqluk	tz'uqluk	tsʼ u q l u kʰ		5. no evidence for borrowing	0.0	
7089	Qeqchi	DRIP (EMIT LIQUID)	okesink	okesink	o k e s i n kʰ		5. no evidence for borrowing	0.0	
9066	Otomi	DRIP (EMIT LIQUID)	ju̲t'i (1)	ju̲t'i	x u t̪ʼ i		5. no evidence for borrowing	0.0	
9067	Otomi	DRIP (EMIT LIQUID)	ju̲xt'i	ju̲xt'i	x u x t̪ʼ i		5. no evidence for borrowing	0.0	
10794	ImbaburaQuechua	DRIP (EMIT LIQUID)	shutuna	shutuna	ʃ u t u n a		5. no evidence for borrowing	0.0	
980	Portuguese	DRIVE	dirigir	dirigir	d i ɾ i ʒ i ɾ				
2699	Spanish	DRIVE	conducir	conducir	k o n d u θ i ɾ				
4290	Yaqui	DRIVE	weetua	weetua	w eː t u a		5. no evidence for borrowing	0.0	
7164	Qeqchi	DRIVE	b'eeresink	b'eeresink	ɓ eː ɾ e s i n kʰ		5. no evidence for borrowing	0.0	
9164	Otomi	DRIVE	e̲t'i	e̲t'i	æ t̪ʼ i		5. no evidence for borrowing	0.0	
9165	Otomi	DRIVE	e̲	e̲	æ		5. no evidence for borrowing	0.0	
9166	Otomi	DRIVE	'yoni	'yoni	ˀj o n i		5. no evidence for borrowing	0.0	
10838	ImbaburaQuechua	DRIVE	manijana	manijana	m a n i x a n a		1. clearly borrowed	1.0	
914	Portuguese	DROP (SOMETHING)	deixar cair	deixar cair	<<d>> <<e>> <<i>> <<x>> <<a>> <<r>> + <<c>> <<a>> <<i>> <<r>>				
2631	Spanish	DROP (SOMETHING)	dejar caer	dejar caer	<<d>> <<e>> <<j>> <<a>> <<r>> + <<c>> <<a>> <<e>> <<r>>				
4229	Yaqui	DROP (SOMETHING)	kom tatabe	kom_tatabe	k o m + t a t a b e		5. no evidence for borrowing	0.0	
5602	ZinacantanTzotzil	DROP (SOMETHING)	p’ahes	p’ahes	pʼ a h e s		5. no evidence for borrowing	0.0	
7074	Qeqchi	DROP (SOMETHING)	xkoq’b’al	xkoq’b’al	ʃ k o qʼ ɓ a l		5. no evidence for borrowing	0.0	
7075	Qeqchi	DROP (SOMETHING)	b’alq’unsink	b’alq’unsink	ɓ a l qʼ u n s i n kʰ		5. no evidence for borrowing	0.0	
9055	Otomi	DROP (SOMETHING)	hegi	hegi	h e g i		5. no evidence for borrowing	0.0	
9056	Otomi	DROP (SOMETHING)	hegi tsots'i	hegi_tsots'i	h e g i + ts o tsʼ i		5. no evidence for borrowing	0.0	
10789	ImbaburaQuechua	DROP (SOMETHING)	kacharina (2)	kacharina	k a tʃ a ɾ i n a		5. no evidence for borrowing	0.0	
451	Portuguese	DROWNED	afogado	afogado	ɐ f u ɡ a d u				
2147	Spanish	DROWNED	ahogado	ahogado	a o ɣ a ð o				
1511	Portuguese	DRUM	tambor	tambor	t ɐ̃ b ɔ ɾ				
3274	Spanish	DRUM	bombo; tambor	bombo	b o m b o				
3275	Spanish	DRUM	bombo; tambor	tambor	t a m b o ɾ				
4760	Yaqui	DRUM	kubaji	kubaji	k u b a j i		5. no evidence for borrowing	0.0	
6064	ZinacantanTzotzil	DRUM	tampol	tampol	t a m p o l		1. clearly borrowed	1.0	
6065	ZinacantanTzotzil	DRUM	vob	vob	v o b		5. no evidence for borrowing	0.0	
7768	Qeqchi	DRUM	tamb'or	tamb'or	t a m ɓ o r		1. clearly borrowed	1.0	
7769	Qeqchi	DRUM	moor	moor	m oː r		5. no evidence for borrowing	0.0	
9922	Otomi	DRUM	bixfani	bixfani	b i x f a n i		5. no evidence for borrowing	0.0	
9923	Otomi	DRUM	tambo	tambo	t̪ a m b o		1. clearly borrowed	1.0	
11227	ImbaburaQuechua	DRUM	tambur	tambur	t a m b u ɾ		1. clearly borrowed	1.0	
497	Portuguese	DRUNK	embriagado	embriagado	ẽ b ɾ j ɐ ɡ a d u				
2195	Spanish	DRUNK	ebrio; embriagado	ebrio	e β ɾ j o				
2196	Spanish	DRUNK	ebrio; embriagado	embriagado	e m b ɾ j a ɣ a ð o				
3884	Yaqui	DRUNK	naamukia	naamukia	n aː m u k i a		5. no evidence for borrowing	0.0	
5305	ZinacantanTzotzil	DRUNK	tzinil	tzinil	tsʰ i n i l		5. no evidence for borrowing	0.0	
6645	Qeqchi	DRUNK	kalajenaq	kalajenaq	k a l a x e n a qʰ		2. probably borrowed	0.75	
8500	Otomi	DRUNK	tixfani	tixfani	t̪ i x f a n i		5. no evidence for borrowing	0.0	
8501	Otomi	DRUNK	zisei	zisei	z i s e i		5. no evidence for borrowing	0.0	
8502	Otomi	DRUNK	mihni	mihni	m i h n i		5. no evidence for borrowing	0.0	
8503	Otomi	DRUNK	nti	nti	n t̪ i		5. no evidence for borrowing	0.0	
10517	ImbaburaQuechua	DRUNK	machashka	machashka	m a tʃ a ʃ k a		5. no evidence for borrowing	0.0	
1335	Portuguese	DRY	seco	seco	s e k u				
3076	Spanish	DRY	seco	seco	s e k o				
4608	Yaqui	DRY	wakia	wakia	w a k i a		5. no evidence for borrowing	0.0	
5924	ZinacantanTzotzil	DRY	takin	takin	t a k i n		5. no evidence for borrowing	0.0	
7586	Qeqchi	DRY	chaqi	chaqi	tʃ a q i		5. no evidence for borrowing	0.0	
7587	Qeqchi	DRY	xujxuj	xujxuj	ʃ u x ʃ u x		5. no evidence for borrowing	0.0	
9640	Otomi	DRY	xi ‘yot'i	xi_‘yot'i	x i + ˀj o t̪ʼ i		5. no evidence for borrowing	0.0	
9641	Otomi	DRY	xi 'ñoni	xi_'ñoni	x i + ˀɲ o n i		5. no evidence for borrowing	0.0	
11089	ImbaburaQuechua	DRY	chakishka	chakishka	tʃ a k i ʃ k a		5. no evidence for borrowing	0.0	
232	Portuguese	DUCK	pato	pato	p a t u				
1926	Spanish	DUCK	pato; ánade	pato	p a t o				
1927	Spanish	DUCK	pato; ánade	ánade	a n a ð e				
