ID	DOCULECT	CONCEPT	VALUE	FORM	TOKENS	NOTE	BORROWED	BORROWED_SCORE	BORROWED_BASE
1670	Portuguese	ABSTAIN FROM FOOD	jejuar	jejuar	ʒ ɨ ʒ w a ɾ				
3438	Spanish	ABSTAIN FROM FOOD	ayunar	ayunar	a ʝ u n a ɾ				
4875	Yaqui	ABSTAIN FROM FOOD	kaa jibwa	kaa_jibwa	k aː + j i bʷ a		5. no evidence for borrowing	0.0	
6140	ZinacantanTzotzil	ABSTAIN FROM FOOD	ch’abah	ch’abah	tʃʼ a ɓ a h		5. no evidence for borrowing	0.0	
6141	ZinacantanTzotzil	ABSTAIN FROM FOOD	tz’ikbail	tz’ikbail	tsʼ i k ɓ a i l		5. no evidence for borrowing	0.0	
7909	Qeqchi	ABSTAIN FROM FOOD	kuyuk sa’	kuyuk_sa’	k u j u k + s a ʔ		5. no evidence for borrowing	0.0	
7910	Qeqchi	ABSTAIN FROM FOOD	ayuunink rix	ayuunink_rix	a j uː n i n k + ɾ i ʃ		1. clearly borrowed	1.0	
10146	Otomi	ABSTAIN FROM FOOD	behe	behe	b e h e		5. no evidence for borrowing	0.0	
10147	Otomi	ABSTAIN FROM FOOD	o̲t'e ya behe	o̲t'e_ya_behe	ə t̪ʼ e + j a + b e h e		5. no evidence for borrowing	0.0	
11313	ImbaburaQuechua	ABSTAIN FROM FOOD	ayunana	ayunana	a j u n a n a		1. clearly borrowed	1.0	
1635	Portuguese	ACCUSE	acusar	acusar	ɐ k u z a ɾ				
3399	Spanish	ACCUSE	acusar; denunciar	acusar	a k u s a ɾ				
3400	Spanish	ACCUSE	acusar; denunciar	denunciar	d e n u n θ j a ɾ				
4844	Yaqui	ACCUSE	jiku’ubwa	jiku’ubwa	j i k u ʔ u bʷ a		5. no evidence for borrowing	0.0	
4845	Yaqui	ACCUSE	yeu bwise	yeu_bwise	j e u + bʷ i s e		5. no evidence for borrowing	0.0	
7874	Qeqchi	ACCUSE	jitok	jitok	x i t o kʰ		5. no evidence for borrowing	0.0	
10097	Otomi	ACCUSE	ka̲ts'i	ka̲ts'i	k ɔ tsʼ i		5. no evidence for borrowing	0.0	
10098	Otomi	ACCUSE	mämbi	mämbi	m ɐ m b i		5. no evidence for borrowing	0.0	
11289	ImbaburaQuechua	ACCUSE	juchachina (1)	juchachina	x u tʃ a tʃ i n a		5. no evidence for borrowing	0.0	
790	Portuguese	ACORN	bolota	bolota	b u l ɔ t ɐ				
2487	Spanish	ACORN	bellota	bellota	b e ʎ o t a				
5510	ZinacantanTzotzil	ACORN	chochob	chochob	tʃʰ o tʃʰ o b		5. no evidence for borrowing	0.0	
6929	Qeqchi	ACORN	ru ji	ru_ji	r u + x i		5. no evidence for borrowing	0.0	
8849	Otomi	ACORN	ro	ro	r o		5. no evidence for borrowing	0.0	
1639	Portuguese	ACQUIT	absolver	absolver	ɐ b s ɔ ɫ v e ɾ				
3404	Spanish	ACQUIT	absolver; exculpar	absolver	a β s o l β ɛ ɾ				
3405	Spanish	ACQUIT	absolver; exculpar	exculpar	ɛ s k u l p a ɾ				
4848	Yaqui	ACQUIT	kulpata a u’ura	kulpata_a_u’ura	k u l p a t a + a + u ʔ u r a		5. no evidence for borrowing	0.0	kulpa = Spanish culpa ‘the guilt’.
7879	Qeqchi	ACQUIT	kuyuk maak	kuyuk_maak	k u j u k + m aː kʰ		5. no evidence for borrowing	0.0	
10102	Otomi	ACQUIT	puni	puni	p u n i		5. no evidence for borrowing	0.0	
11291	ImbaburaQuechua	ACQUIT	kishpichina	kishpichina	k i ʃ p i tʃ i n a		5. no evidence for borrowing	0.0	
1626	Portuguese	ADJUDICATE	julgar	julgar	ʒ u ɫ ɡ a ɾ				
3391	Spanish	ADJUDICATE	juzgar	juzgar	x u ð ɣ a ɾ				
4835	Yaqui	ADJUDICATE	juskaroa	juskaroa	j u s k a r o a		1. clearly borrowed	1.0	
7865	Qeqchi	ADJUDICATE	raqok aatin	raqok_aatin	r a q o k + aː t i n		5. no evidence for borrowing	0.0	
10085	Otomi	ADJUDICATE	o̲t'u̲ts'u̲t'u̲bi	o̲t'u̲ts'u̲t'u̲bi	ə t̪ʼ u tsʼ u t̪ʼ u b i		5. no evidence for borrowing	0.0	
1489	Portuguese	ADMIT	admitir; confessar	admitir	ɐ d m i t i ɾ				
1490	Portuguese	ADMIT	admitir; confessar	confessar	k õ f ɨ s a ɾ				
3252	Spanish	ADMIT	admitir; confesar; reconocer	admitir	a ð m i t i ɾ				
3253	Spanish	ADMIT	admitir; confesar; reconocer	confesar	k o m f e s a ɾ				
3254	Spanish	ADMIT	admitir; confesar; reconocer	reconocer	r e k o n o θ ɛ ɾ				
4739	Yaqui	ADMIT	konpesaroa	konpesaroa	k o n p e s a r o a		1. clearly borrowed	1.0	
6044	ZinacantanTzotzil	ADMIT	hamal 7al	hamal_7al	h a m a l + ʔ a l		5. no evidence for borrowing	0.0	
7749	Qeqchi	ADMIT	xsumenkil	xsumenkil	ʃ s u m e n k i l		5. no evidence for borrowing	0.0	
9887	Otomi	ADMIT	hä (2)	hä	h ɐ		5. no evidence for borrowing	0.0	
9888	Otomi	ADMIT	hegi	hegi	h e g i		5. no evidence for borrowing	0.0	
9889	Otomi	ADMIT	japi ar kaso	japi_ar_kaso	x a p i + a r + k a s o		1. clearly borrowed	1.0	
11209	ImbaburaQuechua	ADMIT	ari nina	ari_nina	a ɾ i + n i n a		5. no evidence for borrowing	0.0	
734	Portuguese	ADOBE	adobe	adobe	ɐ d ɔ b ɨ				
2425	Spanish	ADOBE	adobe	adobe	a ð o β e				
4088	Yaqui	ADOBE	saami	saami	s aː m i		5. no evidence for borrowing	0.0	
5480	ZinacantanTzotzil	ADOBE	shamit	shamit	ʃ a m i tʰ		1. clearly borrowed	1.0	
6878	Qeqchi	ADOBE	xan	xan	ʃ a n		5. no evidence for borrowing	0.0	
6879	Qeqchi	ADOBE	q'ut	q'ut	qʼ u tʰ		5. no evidence for borrowing	0.0	
8781	Otomi	ADOBE	ñäha̲i	ñäha̲i	ɲ ɐ h ɔ i		5. no evidence for borrowing	0.0	
10671	ImbaburaQuechua	ADOBE	adubi	adubi	a d u b i		1. clearly borrowed	1.0	
1647	Portuguese	ADULTERY	adultério	adultério	ɐ d u ɫ t ɛ ɾ j u				
3413	Spanish	ADULTERY	adulterio	adulterio	a ð u l t ɛ ɾ j o				
4856	Yaqui	ADULTERY	baita’a	baita’a	b a i t a ʔ a		5. no evidence for borrowing	0.0	
7887	Qeqchi	ADULTERY	muxuk sumlajik	muxuk_sumlajik	m u ʃ u k + s u m l a x i kʰ		5. no evidence for borrowing	0.0	
7888	Qeqchi	ADULTERY	muxuk	muxuk	m u ʃ u kʰ		5. no evidence for borrowing	0.0	
10112	Otomi	ADULTERY	nthekunthäti	nthekunthäti	n θ e k u n θ ɐ t̪ i		5. no evidence for borrowing	0.0	
839	Portuguese	ADZE	enxó	enxó	ẽ ʃ ɔ				
2544	Spanish	ADZE	azuela	azuela	a θ w e l a				
10742	ImbaburaQuechua	ADZE	aswila	aswila	a s w i l a		1. clearly borrowed	1.0	
1066	Portuguese	AFTER	depois	depois	d ɨ p oi ʃ				
2792	Spanish	AFTER	después	después	d ɛ s p w e s				
4364	Yaqui	AFTER	chukula	chukula	tʃ u k u l a		5. no evidence for borrowing	0.0	
7252	Qeqchi	AFTER	moqon	moqon	m o q o n		5. no evidence for borrowing	0.0	
9267	Otomi	AFTER	‘mefa	‘mefa	ˀm e f a		5. no evidence for borrowing	0.0	
9268	Otomi	AFTER	gem’bu	gem’bu	g e m ʔ b u		5. no evidence for borrowing	0.0	
9269	Otomi	AFTER	'be̲fa	'be̲fa	ˀb æ f a		5. no evidence for borrowing	0.0	
10892	ImbaburaQuechua	AFTER	jipa	jipa	x i p a		5. no evidence for borrowing	0.0	
1253	Portuguese	AFTERNOON	tarde	tarde	t a ɾ d ɨ				
2992	Spanish	AFTERNOON	tarde	tarde	t a ɾ ð e				
4540	Yaqui	AFTERNOON	kupteo	kupteo	k u p t e o		5. no evidence for borrowing	0.0	
5860	ZinacantanTzotzil	AFTERNOON	shmal	shmal	ʃ m a l		5. no evidence for borrowing	0.0	
7490	Qeqchi	AFTERNOON	ewu	ewu	e w u		5. no evidence for borrowing	0.0	
9523	Otomi	AFTERNOON	nde	nde	n d e		5. no evidence for borrowing	0.0	
11024	ImbaburaQuechua	AFTERNOON	chishi	chishi	tʃ i ʃ i		5. no evidence for borrowing	0.0	
1245	Portuguese	AGAIN	outra vez; de novo	outra vez	<<o>> <<u>> <<t>> <<r>> <<a>> + <<v>> <<e>> <<z>>				
1246	Portuguese	AGAIN	outra vez; de novo	de novo	<<d>> <<e>> + <<n>> <<o>> <<v>> <<o>>				
2984	Spanish	AGAIN	otra vez; de nuevo	otra vez	<<o>> <<t>> <<r>> <<a>> + <<v>> <<e>> <<z>>				
2985	Spanish	AGAIN	otra vez; de nuevo	de nuevo	<<d>> <<e>> + <<n>> <<u>> <<e>> <<v>> <<o>>				
4532	Yaqui	AGAIN	intuchia	intuchia	i n t u tʃ i a		5. no evidence for borrowing	0.0	
4533	Yaqui	AGAIN	juchia	juchia	j u tʃ i a		5. no evidence for borrowing	0.0	
5854	ZinacantanTzotzil	AGAIN	noshtok	noshtok	n o ʃ t o k		5. no evidence for borrowing	0.0	
7485	Qeqchi	AGAIN	wi' chik	wi'_chik	w i ʔ + tʃ i kʰ		5. no evidence for borrowing	0.0	
9516	Otomi	AGAIN	ma n’agi	ma_n’agi	m a + n ʔ a g i		5. no evidence for borrowing	0.0	
11020	ImbaburaQuechua	AGAIN	kutin	kutin	k u t i ŋ		5. no evidence for borrowing	0.0	
1213	Portuguese	AGE	idade	idade	i d a d ɨ				
2945	Spanish	AGE	edad	edad	e ð a ð				
4498	Yaqui	AGE	wasuktia	wasuktia	w a s u k t i a		5. no evidence for borrowing	0.0	
5829	ZinacantanTzotzil	AGE	ch’iel	ch’iel	tʃʼ i e l		5. no evidence for borrowing	0.0	
7443	Qeqchi	AGE	xchi hab’	xchi_hab’	ʃ tʃ i + h a ɓ		5. no evidence for borrowing	0.0	
9469	Otomi	AGE	je̲ya	je̲ya	x æ j a		5. no evidence for borrowing	0.0	
76	Portuguese	AIR	ar	ar	a ɾ				
1757	Spanish	AIR	aire	aire	a i ɾ e				
3507	Yaqui	AIR	jeeka	jeeka	j eː k a		5. no evidence for borrowing	0.0	
4944	ZinacantanTzotzil	AIR	7ik’	7ik’	ʔ i kʼ		5. no evidence for borrowing	0.0	
6210	Qeqchi	AIR	iq’	iq’	i qʼ		5. no evidence for borrowing	0.0	
7993	Otomi	AIR	ndähi	ndähi	n d ɐ h i		5. no evidence for borrowing	0.0	
10209	ImbaburaQuechua	AIR	samay	samay	s a m a j		5. no evidence for borrowing	0.0	
601	Portuguese	ALCOHOL (FERMENTED DRINK)	bebida fermentada	bebida fermentada	<<b>> <<e>> <<b>> <<i>> <<d>> <<a>> + <<f>> <<e>> <<r>> <<m>> <<e>> <<n>> <<t>> <<a>> <<d>> <<a>>				
2293	Spanish	ALCOHOL (FERMENTED DRINK)	bebida fermentada	bebida fermentada	<<b>> <<e>> <<b>> <<i>> <<d>> <<a>> + <<f>> <<e>> <<r>> <<m>> <<e>> <<n>> <<t>> <<a>> <<d>> <<a>>				
3974	Yaqui	ALCOHOL (FERMENTED DRINK)	ba’ajipo’okoim	ba’ajipo’okoim	b a ʔ a j i p o ʔ o k o i m		5. no evidence for borrowing	0.0	
6757	Qeqchi	ALCOHOL (FERMENTED DRINK)	b’oj	b’oj	ɓ o x		5. no evidence for borrowing	0.0	
6758	Qeqchi	ALCOHOL (FERMENTED DRINK)	ani (2)	ani	a n i		5. no evidence for borrowing	0.0	
8622	Otomi	ALCOHOL (FERMENTED DRINK)	sei	sei	s e i		5. no evidence for borrowing	0.0	
10590	ImbaburaQuechua	ALCOHOL (FERMENTED DRINK)	asua	asua	a s u a		5. no evidence for borrowing	0.0	
1186	Portuguese	ALL	cada; tudo	cada	k a d ɐ				
1187	Portuguese	ALL	cada; tudo	tudo	t u d u				
2919	Spanish	ALL	cada; todo	cada	k a ð a				
2920	Spanish	ALL	cada; todo	todo	t o ð o				
4477	Yaqui	ALL	si’ime (2)	si’ime	s i ʔ i m e		5. no evidence for borrowing	0.0	
5813	ZinacantanTzotzil	ALL	kotol	kotol	k o t o l		5. no evidence for borrowing	0.0	
5814	ZinacantanTzotzil	ALL	labal	labal	l a ɓ a l		5. no evidence for borrowing	0.0	
7400	Qeqchi	ALL	chi junil	chi_junil	tʃ i + x u n i l		5. no evidence for borrowing	0.0	
7401	Qeqchi	ALL	anchal	anchal	a n tʃ a l		5. no evidence for borrowing	0.0	
7402	Qeqchi	ALL	rek’	rek’	r e kʼ		5. no evidence for borrowing	0.0	
9426	Otomi	ALL	ga̲tho	ga̲tho	g ɔ θ o		5. no evidence for borrowing	0.0	
9427	Otomi	ALL	kadu̲	kadu̲	k a d u		1. clearly borrowed	1.0	
9428	Otomi	ALL	ta̲t’i	ta̲t’i	t̪ ɔ t̪ʼ i		5. no evidence for borrowing	0.0	
10979	ImbaburaQuechua	ALL	tukuy	tukuy	t u k u j		5. no evidence for borrowing	0.0	
1545	Portuguese	ALLOW OR PERMIT	deixar; permitir	deixar	d ɐi ʃ a ɾ				
1546	Portuguese	ALLOW OR PERMIT	deixar; permitir	permitir	p ɨ ɾ m i t i ɾ				
3312	Spanish	ALLOW OR PERMIT	permitir; dejar	permitir	p ɛ ɾ m i t i ɾ				
3313	Spanish	ALLOW OR PERMIT	permitir; dejar	dejar	d e x a ɾ				
1658	Portuguese	ALTAR	altar	altar	a ɫ t a ɾ				
3423	Spanish	ALTAR	altar	altar	a l t a ɾ				
4865	Yaqui	ALTAR	altaar	altaar	a l t aː r		1. clearly borrowed	1.0	
6128	ZinacantanTzotzil	ALTAR	7altal	7altal	ʔ a l t a l		1. clearly borrowed	1.0	
7898	Qeqchi	ALTAR	artal	artal	a ɾ t a l		1. clearly borrowed	1.0	
10125	Otomi	ALTAR	ntsaya jwä	ntsaya_jwä	n ts a j a + xʷ ɐ		5. no evidence for borrowing	0.0	
10126	Otomi	ALTAR	tsita	tsita	ts i t̪ a		5. no evidence for borrowing	0.0	
10127	Otomi	ALTAR	ata	ata	a t̪ a		1. clearly borrowed	1.0	
11305	ImbaburaQuechua	ALTAR	altar	altar	a l t a ɾ		1. clearly borrowed	1.0	
1238	Portuguese	ALWAYS	sempre	sempre	s ẽ p ɾ ɨ				
2976	Spanish	ALWAYS	siempre	siempre	s j e m p ɾ e				
4522	Yaqui	ALWAYS	jiba	jiba	j i b a		5. no evidence for borrowing	0.0	
4523	Yaqui	ALWAYS	chikti	chikti	tʃ i k t i		5. no evidence for borrowing	0.0	
5848	ZinacantanTzotzil	ALWAYS	sempre	sempre	s e m p ɾ e		1. clearly borrowed	1.0	
7479	Qeqchi	ALWAYS	junelik	junelik	x u n e l i kʰ		5. no evidence for borrowing	0.0	
9506	Otomi	ALWAYS	zäntho	zäntho	z ɐ n θ o		5. no evidence for borrowing	0.0	
9507	Otomi	ALWAYS	(n)zäm'bu̲	(n)zäm'bu̲	n z ɐ m ˀb u		5. no evidence for borrowing	0.0	
11014	ImbaburaQuechua	ALWAYS	simpri	simpri	s i m b ɾ i		1. clearly borrowed	1.0	
1605	Portuguese	AMBUSH	emboscada	emboscada	ẽ b u ʃ k a d ɐ				
3372	Spanish	AMBUSH	acechar; emboscar	acechar	a θ e tʃ a ɾ				
3373	Spanish	AMBUSH	acechar; emboscar	emboscar	e m b o s k a ɾ				
4820	Yaqui	AMBUSH	bo’o yejteria	bo’o_yejteria	b o ʔ o + j e j t e r i a		5. no evidence for borrowing	0.0	
10052	Otomi	AMBUSH	nt’ä	nt’ä	n t̪ʼ ɐ		5. no evidence for borrowing	0.0	
10053	Otomi	AMBUSH	nu (3)	nu	n u		5. no evidence for borrowing	0.0	
159	Portuguese	ANCESTORS	antepassados; ancestrais	antepassados	ɐ̃ t ɨ p ɐ s a d u ʃ				
160	Portuguese	ANCESTORS	antepassados; ancestrais	ancestrais	ɐ̃ s ɨ ʃ t ɾ ai ʃ				
1839	Spanish	ANCESTORS	antepasados	antepasados	a n t e p a s a ð o s				
3594	Yaqui	ANCESTORS	yo’owe ~ yoowe	yo’owe	j o ʔ o w e		5. no evidence for borrowing	0.0	
5013	ZinacantanTzotzil	ANCESTORS	7antivo	7antivo	ʔ a n t i v o		1. clearly borrowed	1.0	
6295	Qeqchi	ANCESTORS	xe’toon	xe’toon	ʃ e ʔ t oː n		5. no evidence for borrowing	0.0	
8090	Otomi	ANCESTORS	mbo̲xita	mbo̲xita	m b ə x i t̪ a		5. no evidence for borrowing	0.0	
10273	ImbaburaQuechua	ANCESTORS	ñaupa runakuna	ñaupa_runakuna	ɲ a u p a + ɾ u n a k u n a		5. no evidence for borrowing	0.0	
1006	Portuguese	ANCHOR	âncora	âncora	ɐ̃ k u ɾ ɐ				
2723	Spanish	ANCHOR	ancla	ancla	a n k l a				
4315	Yaqui	ANCHOR	amklam	amklam	a m k l a m		1. clearly borrowed	1.0	
1452	Portuguese	AND	e	e	i				
3210	Spanish	AND	y	y	i				
4703	Yaqui	AND	into	into	i n t o		5. no evidence for borrowing	0.0	
6008	ZinacantanTzotzil	AND	7i	7i	ʔ i		3. perhaps borrowed	0.5	
7707	Qeqchi	AND	ut	ut	u tʰ		5. no evidence for borrowing	0.0	
9812	Otomi	AND	ne (3)	ne	n e		5. no evidence for borrowing	0.0	
11175	ImbaburaQuechua	AND	-pash	-pash	p a ʃ		5. no evidence for borrowing	0.0	
1373	Portuguese	ANGER	raiva; ira	raiva	ʁ ai v ɐ				
1374	Portuguese	ANGER	raiva; ira	ira	i ɾ ɐ				
3114	Spanish	ANGER	enojo; ira; rabia	enojo	e n o x o				
3115	Spanish	ANGER	enojo; ira; rabia	ira	i ɾ a				
3116	Spanish	ANGER	enojo; ira; rabia	rabia	r a β j a				
4635	Yaqui	ANGER	omtia	omtia	o m t i a		5. no evidence for borrowing	0.0	
5948	ZinacantanTzotzil	ANGER	k’ak’al	k’ak’al	kʼ a kʼ a l		5. no evidence for borrowing	0.0	
7621	Qeqchi	ANGER	waxerk	waxerk	w a ʃ e ɾ kʰ		5. no evidence for borrowing	0.0	
7622	Qeqchi	ANGER	josq'il	josq'il	x o s qʼ i l		5. no evidence for borrowing	0.0	
7623	Qeqchi	ANGER	po'jik	po'jik	p o ʔ x i kʰ		5. no evidence for borrowing	0.0	
9681	Otomi	ANGER	(mbo̲)kwe̲	(mbo̲)kwe̲	m b ə kʷ æ		5. no evidence for borrowing	0.0	
11115	ImbaburaQuechua	ANGER	fiña (1)	fiña	ɸ i ɲ a		5. no evidence for borrowing	0.0	
193	Portuguese	ANIMAL	animal; bicho	animal	ɐ n i m a ɫ				
194	Portuguese	ANIMAL	animal; bicho	bicho	b i ʃ u				
1877	Spanish	ANIMAL	animal	animal	a n i m a l				
3621	Yaqui	ANIMAL	animaal	animaal	a n i m aː l		1. clearly borrowed	1.0	
5033	ZinacantanTzotzil	ANIMAL	7animal	7animal	ʔ a n i m a l		1. clearly borrowed	1.0	
5034	ZinacantanTzotzil	ANIMAL	chanulil	chanulil	tʃʰ a n u l i l		5. no evidence for borrowing	0.0	
5035	ZinacantanTzotzil	ANIMAL	chon	chon	tʃʰ o n		5. no evidence for borrowing	0.0	
6327	Qeqchi	ANIMAL	xul	xul	ʃ u l		5. no evidence for borrowing	0.0	
8160	Otomi	ANIMAL	zu'we	zu'we	z u ˀw e		5. no evidence for borrowing	0.0	
10298	ImbaburaQuechua	ANIMAL	animal	animal	a n i m a l		1. clearly borrowed	1.0	
383	Portuguese	ANKLE	tornozelo	tornozelo	t u ɾ n u z ɛ l u				
2080	Spanish	ANKLE	tobillo	tobillo	t o β i ʎ o				
3790	Yaqui	ANKLE	tero’okim	tero’okim	t e r o ʔ o k i m		5. no evidence for borrowing	0.0	
5208	ZinacantanTzotzil	ANKLE	nuk’ 7okol	nuk’_7okol	n u kʼ + ʔ o k o l		5. no evidence for borrowing	0.0	
6526	Qeqchi	ANKLE	kux oq	kux_oq	k u ʃ + o qʰ		5. no evidence for borrowing	0.0	
6527	Qeqchi	ANKLE	xmap oq	xmap_oq	ʃ m a p + o qʰ		5. no evidence for borrowing	0.0	
8381	Otomi	ANKLE	bots'undo'yo wa	bots'undo'yo_wa	b o tsʼ u n d o ˀj o + w a		5. no evidence for borrowing	0.0	
10441	ImbaburaQuechua	ANKLE	chaki muku	chaki_muku	tʃ a k i + m u k u		5. no evidence for borrowing	0.0	
1500	Portuguese	ANNOUNCE	anunciar	anunciar	ɐ n ũ s j a ɾ				
3263	Spanish	ANNOUNCE	anunciar; avisar	anunciar	a n u n θ j a ɾ				
3264	Spanish	ANNOUNCE	anunciar; avisar	avisar	a β i s a ɾ				
4749	Yaqui	ANNOUNCE	anunsiaroa	anunsiaroa	a n u n s i a r o a		1. clearly borrowed	1.0	
4750	Yaqui	ANNOUNCE	tejwa	tejwa	t e j w a		5. no evidence for borrowing	0.0	
6056	ZinacantanTzotzil	ANNOUNCE	7al	7al	ʔ a l		5. no evidence for borrowing	0.0	
7757	Qeqchi	ANNOUNCE	esilank	esilank	e s i l a n kʰ		5. no evidence for borrowing	0.0	
9906	Otomi	ANNOUNCE	no̲ni	no̲ni	n ə n i		5. no evidence for borrowing	0.0	
9907	Otomi	ANNOUNCE	bembi	bembi	b e m b i		5. no evidence for borrowing	0.0	
11218	ImbaburaQuechua	ANNOUNCE	billana	billana	b i ʒ a n a		5. no evidence for borrowing	0.0	
1488	Portuguese	ANSWER	responder	responder	ʁ ɨ ʃ p õ d e ɾ				
3250	Spanish	ANSWER	contestar; responder	contestar	k o n t ɛ s t a ɾ				
3251	Spanish	ANSWER	contestar; responder	responder	r ɛ s p o n d ɛ ɾ				
4738	Yaqui	ANSWER	yoopna	yoopna	j oː p n a		5. no evidence for borrowing	0.0	
6043	ZinacantanTzotzil	ANSWER	tak’	tak’	t a kʼ		5. no evidence for borrowing	0.0	
7747	Qeqchi	ANSWER	chaq'b'enk	chaq'b'enk	tʃ a qʼ ɓ e n kʰ		5. no evidence for borrowing	0.0	
7748	Qeqchi	ANSWER	sumenk	sumenk	s u m e n kʰ		5. no evidence for borrowing	0.0	
9884	Otomi	ANSWER	thädi	thädi	θ ɐ d i		5. no evidence for borrowing	0.0	
9885	Otomi	ANSWER	thäti	thäti	θ ɐ t̪ i		5. no evidence for borrowing	0.0	
9886	Otomi	ANSWER	kots'i	kots'i	k o tsʼ i		5. no evidence for borrowing	0.0	
11208	ImbaburaQuechua	ANSWER	kutichina	kutichina	k u t i tʃ i n a		5. no evidence for borrowing	0.0	
285	Portuguese	ANT	formiga	formiga	f u ɾ m i ɡ ɐ				
1980	Spanish	ANT	hormiga	hormiga	o ɾ m i ɣ a				
3696	Yaqui	ANT	eeye	eeye	eː j e		5. no evidence for borrowing	0.0	
5105	ZinacantanTzotzil	ANT	shinich	shinich	ʃ i n i tʃʰ		5. no evidence for borrowing	0.0	
6414	Qeqchi	ANT	sank	sank	s a n kʰ		5. no evidence for borrowing	0.0	
8277	Otomi	ANT	xäju̲	xäju̲	x ɐ x u		5. no evidence for borrowing	0.0	
10359	ImbaburaQuechua	ANT	añanku	añanku	a ɲ a ŋ g u		5. no evidence for borrowing	0.0	
876	Portuguese	ANVIL	bigorna	bigorna	b i ɡ ɔ ɾ n ɐ				
2586	Spanish	ANVIL	yunque	yunque	ɟ ʝ u n k e				
9009	Otomi	ANVIL	nt'u̲xu̲bo̲jä	nt'u̲xu̲bo̲jä	n t̪ʼ u x u b ə x ɐ		5. no evidence for borrowing	0.0	
1364	Portuguese	ANXIETY	ansiedade; preocupação	ansiedade	ɐ̃ s i ɨ d a d ɨ				
1365	Portuguese	ANXIETY	ansiedade; preocupação	preocupação	p ɾ i u k u p ɐ s ɐ̃ũ				
3103	Spanish	ANXIETY	ansiedad; angustia; preocupación	ansiedad	a n s j e ð a ð				
3104	Spanish	ANXIETY	ansiedad; angustia; preocupación	angustia	a n g u s t j a				
3105	Spanish	ANXIETY	ansiedad; angustia; preocupación	preocupación	p ɾ e o k u p a θ j o n				
4627	Yaqui	ANXIETY	jiokot ea	jiokot_ea	j i o k o t + e a		5. no evidence for borrowing	0.0	
5943	ZinacantanTzotzil	ANXIETY	k’op 7o7on	k’op_7o7on	kʼ o p + ʔ o ʔ o n		5. no evidence for borrowing	0.0	
7612	Qeqchi	ANXIETY	yot'ik	yot'ik	j o tʼ i kʰ		5. no evidence for borrowing	0.0	
9673	Otomi	ANXIETY	dumu̲i	dumu̲i	d u m u i		5. no evidence for borrowing	0.0	
11108	ImbaburaQuechua	ANXIETY	llaki	llaki	ʒ a k i		5. no evidence for borrowing	0.0	
968	Portuguese	APPROACH	aproximar	aproximar	ɐ p ɾ u s i m a ɾ				
2684	Spanish	APPROACH	acercarse; aproximarse	acercarse	a θ ɛ ɾ k a ɾ s e				
2685	Spanish	APPROACH	acercarse; aproximarse	aproximarse	a p ɾ o k s i m a ɾ s e				
4279	Yaqui	APPROACH	rukte	rukte	r u k t e		5. no evidence for borrowing	0.0	
4280	Yaqui	APPROACH	rukta	rukta	r u k t a		5. no evidence for borrowing	0.0	
5652	ZinacantanTzotzil	APPROACH	nopoj	nopoj	n o p o ħ		5. no evidence for borrowing	0.0	
7142	Qeqchi	APPROACH	haye'k	haye'k	h a j e ʔ kʰ		5. no evidence for borrowing	0.0	
7143	Qeqchi	APPROACH	nach'o'k	nach'o'k	n a tʃʼ o ʔ kʰ		5. no evidence for borrowing	0.0	
7144	Qeqchi	APPROACH	jeqonk	jeqonk	x e q o n kʰ		5. no evidence for borrowing	0.0	
7145	Qeqchi	APPROACH	jiqe'k	jiqe'k	x i q e ʔ kʰ		5. no evidence for borrowing	0.0	
7146	Qeqchi	APPROACH	jilonk	jilonk	x i l o n kʰ		5. no evidence for borrowing	0.0	
9142	Otomi	APPROACH	kwat'i	kwat'i	kʷ a t̪ʼ i		5. no evidence for borrowing	0.0	
10828	ImbaburaQuechua	APPROACH	kayllayana	kayllayana	k a j ʒ a j a n a		5. no evidence for borrowing	0.0	
730	Portuguese	ARCH	arco	arco	a ɾ k u				
2420	Spanish	ARCH	arco	arco	a ɾ k o				
4084	Yaqui	ARCH	arko	arko	a r k o		1. clearly borrowed	1.0	
5477	ZinacantanTzotzil	ARCH	7alku7	7alku7	ʔ a l k u ʔ		1. clearly borrowed	1.0	
6875	Qeqchi	ARCH	arko	arko	a ɾ k o		1. clearly borrowed	1.0	
8773	Otomi	ARCH	nsä'mi	nsä'mi	ⁿs ɐ ˀm i		5. no evidence for borrowing	0.0	
8774	Otomi	ARCH	arko	arko	a r k o		1. clearly borrowed	1.0	
10668	ImbaburaQuechua	ARCH	arku	arku	a ɾ k u		1. clearly borrowed	1.0	
367	Portuguese	ARM	braço	braço	b ɾ a s u				
2063	Spanish	ARM	brazo	brazo	b ɾ a θ o				
3774	Yaqui	ARM	mamam	mamam	m a m a m		5. no evidence for borrowing	0.0	
5188	ZinacantanTzotzil	ARM	k’obol	k’obol	kʼ o ɓ o l		5. no evidence for borrowing	0.0	
6510	Qeqchi	ARM	tel	tel	t e l		5. no evidence for borrowing	0.0	
8364	Otomi	ARM	'ye̲	'ye̲	ˀj æ		5. no evidence for borrowing	0.0	
10427	ImbaburaQuechua	ARM	rigra	rigra	ʐ i g ɾ a		5. no evidence for borrowing	0.0	
1587	Portuguese	ARMOUR	armadura	armadura	ɐ ɾ m ɐ d u ɾ ɐ				
3353	Spanish	ARMOUR	armadura	armadura	a ɾ m a ð u ɾ a				
7829	Qeqchi	ARMOUR	ch’iich’	ch’iich’	tʃʼ iː tʃʼ		5. no evidence for borrowing	0.0	
10020	Otomi	ARMOUR	nt'u̲t'i	nt'u̲t'i	n t̪ʼ u t̪ʼ i		5. no evidence for borrowing	0.0	
10021	Otomi	ARMOUR	nthoki	nthoki	n θ o k i		5. no evidence for borrowing	0.0	
10022	Otomi	ARMOUR	nxo̲ge	nxo̲ge	n x ə g e		5. no evidence for borrowing	0.0	
11265	ImbaburaQuechua	ARMOUR	armadura	armadura	a ɾ m a d u ɾ a		1. clearly borrowed	1.0	
368	Portuguese	ARMPIT	axila; sovaco	axila	ɐ k s i l ɐ				
369	Portuguese	ARMPIT	axila; sovaco	sovaco	s u v a k u				
2064	Spanish	ARMPIT	sobaco; axila	sobaco	s o β a k o				
2065	Spanish	ARMPIT	sobaco; axila	axila	a k s i l a				
3775	Yaqui	ARMPIT	seekam	seekam	s eː k a m		5. no evidence for borrowing	0.0	
5189	ZinacantanTzotzil	ARMPIT	lotz’opil	lotz’opil	l o tsʼ o p i l		5. no evidence for borrowing	0.0	
6511	Qeqchi	ARMPIT	sa’ tel	sa’_tel	s a ʔ + t e l		5. no evidence for borrowing	0.0	
8365	Otomi	ARMPIT	kaxjo	kaxjo	k a x x o		5. no evidence for borrowing	0.0	
10428	ImbaburaQuechua	ARMPIT	subaku	subaku	s u b a k u		1. clearly borrowed	1.0	
1571	Portuguese	ARMY	exército	exército	i z ɛ ɾ s i t u				
3339	Spanish	ARMY	ejército; tropas	ejército	e x ɛ ɾ θ i t o				
3340	Spanish	ARMY	ejército; tropas	tropas	t ɾ o p a s				
4801	Yaqui	ARMY	troopa	troopa	t r oː p a		1. clearly borrowed	1.0	
7815	Qeqchi	ARMY	soldaa, sola	soldaa	s o l d aː		1. clearly borrowed	1.0	
10003	Otomi	ARMY	ejersito	ejersito	e x e r s i t̪ o		1. clearly borrowed	1.0	
10004	Otomi	ARMY	tropa	tropa	t̪ r o p a		1. clearly borrowed	1.0	
10005	Otomi	ARMY	hmunts'u̲sundado	hmunts'u̲sundado	h m u n tsʼ u s u n d a d o		1. clearly borrowed	1.0	
11259	ImbaburaQuechua	ARMY	aukakuna	aukakuna	a u k a k u n a		5. no evidence for borrowing	0.0	
967	Portuguese	ARRIVE	chegar	chegar	ʃ ɨ ɡ a ɾ				
2682	Spanish	ARRIVE	llegar; alcanzar	llegar	ʎ e ɣ a ɾ				
2683	Spanish	ARRIVE	llegar; alcanzar	alcanzar	a l k a n θ a ɾ				
4278	Yaqui	ARRIVE	jajame	jajame	j a j a m e		5. no evidence for borrowing	0.0	
5649	ZinacantanTzotzil	ARRIVE	yul	yul	j u l		5. no evidence for borrowing	0.0	
5650	ZinacantanTzotzil	ARRIVE	k’ot	k’ot	kʼ o tʰ		5. no evidence for borrowing	0.0	
5651	ZinacantanTzotzil	ARRIVE	tal	tal	t a l		5. no evidence for borrowing	0.0	
7140	Qeqchi	ARRIVE	k'ulunk	k'ulunk	k ʔ u l u n kʰ		5. no evidence for borrowing	0.0	
7141	Qeqchi	ARRIVE	hulak	hulak	h u l a kʰ		5. no evidence for borrowing	0.0	
9137	Otomi	ARRIVE	tso̲ho̲ (2)	tso̲ho̲	ts ə h ə		5. no evidence for borrowing	0.0	
9138	Otomi	ARRIVE	tso̲kwa	tso̲kwa	ts ə kʷ a		5. no evidence for borrowing	0.0	
9139	Otomi	ARRIVE	tso̲ni	tso̲ni	ts ə n i		5. no evidence for borrowing	0.0	
9140	Otomi	ARRIVE	tso̲t'e	tso̲t'e	ts ə t̪ʼ e		5. no evidence for borrowing	0.0	
9141	Otomi	ARRIVE	tso̲ts'e	tso̲ts'e	ts ə tsʼ e		5. no evidence for borrowing	0.0	
10827	ImbaburaQuechua	ARRIVE	chayana	chayana	tʃ a j a n a		5. no evidence for borrowing	0.0	
1581	Portuguese	ARROW	flecha	flecha	f l ɐ ʃ ɐ				
3348	Spanish	ARROW	flecha	flecha	f l e tʃ a				
4808	Yaqui	ARROW	kuta juiwam	kuta_juiwam	k u t a + j u i w a m		5. no evidence for borrowing	0.0	
6097	ZinacantanTzotzil	ARROW	p’ilom te7	p’ilom_te7	pʼ i l o m + t e ʔ		5. no evidence for borrowing	0.0	
7825	Qeqchi	ARROW	simaj	simaj	s i m a x		5. no evidence for borrowing	0.0	
7826	Qeqchi	ARROW	tzimaj	tzimaj	t z i m a x		5. no evidence for borrowing	0.0	
10016	Otomi	ARROW	mfit'i	mfit'i	m f i t̪ʼ i		5. no evidence for borrowing	0.0	
1650	Portuguese	ARSON	incêndio culposo	incêndio culposo	<<i>> <<n>> <<c>> <<ê>> <<n>> <<d>> <<i>> <<o>> + <<c>> <<u>> <<l>> <<p>> <<o>> <<s>> <<o>>				
3415	Spanish	ARSON	incendio premeditado	incendio premeditado	<<i>> <<n>> <<c>> <<e>> <<n>> <<d>> <<i>> <<o>> + <<p>> <<r>> <<e>> <<m>> <<e>> <<d>> <<i>> <<t>> <<a>> <<d>> <<o>>				
4859	Yaqui	ARSON	ju’unakteka jittaji	ju’unakteka_jittaji	j u ʔ u n a k t e k a + j i t t a j i		5. no evidence for borrowing	0.0	
10115	Otomi	ARSON	nzät'i ts'u̲ ar mu̲i	nzät'i_ts'u̲_ar_mu̲i	n z ɐ t̪ʼ i + tsʼ u + a r + m u i		5. no evidence for borrowing	0.0	
11299	ImbaburaQuechua	ARSON	rupachina (2)	rupachina	ʐ u p a tʃ i n a		5. no evidence for borrowing	0.0	
88	Portuguese	ASH	cinzas	cinzas	s ĩ z ɐ ʃ				
1769	Spanish	ASH	cenizas	cenizas	θ e n i θ a s				
3518	Yaqui	ASH	naposa	naposa	n a p o s a		5. no evidence for borrowing	0.0	
4954	ZinacantanTzotzil	ASH	tan	tan	t a n		5. no evidence for borrowing	0.0	
