ID	DOCULECT	CONCEPT	VALUE	FORM	TOKENS	NOTE	BORROWED	BORROWED_SCORE	BORROWED_BASE
9299	Otomi	LIE DOWN	'be̲ni jar fidi	'be̲ni_jar_fidi	ˀb æ n i + x a r + f i d i		5. no evidence for borrowing	0.0	
10904	ImbaburaQuechua	LIE DOWN	sirina	sirina	s i ɾ i n a		5. no evidence for borrowing	0.0	
917	Portuguese	LIFT	levantar; içar	levantar	l ɨ v ɐ̃ t a ɾ				
918	Portuguese	LIFT	levantar; içar	içar	i s a ɾ				
2635	Spanish	LIFT	levantar	levantar	l e β a n t a ɾ				
4232	Yaqui	LIFT	pu’akta	pu’akta	p u ʔ a k t a		5. no evidence for borrowing	0.0	
5606	ZinacantanTzotzil	LIFT	toy	toy	t o j		5. no evidence for borrowing	0.0	
5607	ZinacantanTzotzil	LIFT	lik	lik	l i k		5. no evidence for borrowing	0.0	
5608	ZinacantanTzotzil	LIFT	tam	tam	t a m		5. no evidence for borrowing	0.0	
5609	ZinacantanTzotzil	LIFT	totz	totz	t o tsʰ		5. no evidence for borrowing	0.0	
7081	Qeqchi	LIFT	paqonk	paqonk	p a q o n kʰ		5. no evidence for borrowing	0.0	
7082	Qeqchi	LIFT	waklesink	waklesink	w a k l e s i n kʰ		5. no evidence for borrowing	0.0	
9060	Otomi	LIFT	juts’i	juts’i	x u tsʼ i		5. no evidence for borrowing	0.0	
9061	Otomi	LIFT	pats'i	pats'i	p a tsʼ i		5. no evidence for borrowing	0.0	
9062	Otomi	LIFT	'wäts'i	'wäts'i	ˀw ɐ tsʼ i		5. no evidence for borrowing	0.0	
10792	ImbaburaQuechua	LIFT	shayachina (1)	shayachina	ʃ a j a tʃ i n a		5. no evidence for borrowing	0.0	
1309	Portuguese	LIGHT (COLOR)	claro	claro	k l a ɾ u				
3050	Spanish	LIGHT (COLOR)	claro	claro	k l a ɾ o				
4588	Yaqui	LIGHT (COLOR)	tosali	tosali	t o s a l i		5. no evidence for borrowing	0.0	
7544	Qeqchi	LIGHT (COLOR)	saqen	saqen	s a q e n		5. no evidence for borrowing	0.0	
7545	Qeqchi	LIGHT (COLOR)	raxk'urin	raxk'urin	r a ʃ kʼ u ɾ i n		5. no evidence for borrowing	0.0	
9603	Otomi	LIGHT (COLOR)	xi nzi	xi_nzi	x i + n z i		5. no evidence for borrowing	0.0	
11069	ImbaburaQuechua	LIGHT (COLOR)	punchalla	punchalla	p u n dʒ a ʒ a		5. no evidence for borrowing	0.0	
94	Portuguese	LIGHT (IGNITE)	acender; atear	acender	ɐ s ẽ d e ɾ				
95	Portuguese	LIGHT (IGNITE)	acender; atear	atear	ɐ t i a ɾ				
1774	Spanish	LIGHT (IGNITE)	encender	encender	e n θ e n d ɛ ɾ				
3522	Yaqui	LIGHT (IGNITE)	taya	taya	t a j a		5. no evidence for borrowing	0.0	
4957	ZinacantanTzotzil	LIGHT (IGNITE)	tiles	tiles	t i l e s		5. no evidence for borrowing	0.0	
6227	Qeqchi	LIGHT (IGNITE)	tz’ab’	tz’ab’	tsʼ a ɓ		5. no evidence for borrowing	0.0	
6228	Qeqchi	LIGHT (IGNITE)	k’ehok xam	k’ehok_xam	kʼ e h o k + ʃ a m		5. no evidence for borrowing	0.0	
8009	Otomi	LIGHT (IGNITE)	the̲ti	the̲ti	θ æ t̪ i		5. no evidence for borrowing	0.0	
8010	Otomi	LIGHT (IGNITE)	tso̲ke	tso̲ke	ts ə k e		5. no evidence for borrowing	0.0	
8011	Otomi	LIGHT (IGNITE)	udi	udi	u d i		5. no evidence for borrowing	0.0	
8012	Otomi	LIGHT (IGNITE)	fe̲ts'i	fe̲ts'i	f æ tsʼ i		5. no evidence for borrowing	0.0	
10223	ImbaburaQuechua	LIGHT (IGNITE)	japichina	japichina	x a p i tʃ i n a		5. no evidence for borrowing	0.0	
72	Portuguese	LIGHT (RADIATION)	luz	luz	l u ʃ				
1752	Spanish	LIGHT (RADIATION)	luz	luz	l u θ				
3503	Yaqui	LIGHT (RADIATION)	tachiria	tachiria	t a tʃ i r i a		5. no evidence for borrowing	0.0	
4937	ZinacantanTzotzil	LIGHT (RADIATION)	k’ak’al	k’ak’al	kʼ a kʼ a l		5. no evidence for borrowing	0.0	
4938	ZinacantanTzotzil	LIGHT (RADIATION)	k’ok’	k’ok’	kʼ o kʼ		5. no evidence for borrowing	0.0	
4939	ZinacantanTzotzil	LIGHT (RADIATION)	lus	lus	l u s		1. clearly borrowed	1.0	
6205	Qeqchi	LIGHT (RADIATION)	saqen	saqen	s a q e n		5. no evidence for borrowing	0.0	
7987	Otomi	LIGHT (RADIATION)	ñot’i	ñot’i	ɲ o t̪ʼ i		5. no evidence for borrowing	0.0	
7988	Otomi	LIGHT (RADIATION)	tsibi	tsibi	ts i b i		5. no evidence for borrowing	0.0	
10205	ImbaburaQuechua	LIGHT (RADIATION)	micha	micha	m i tʃ a		1. clearly borrowed	1.0	
1332	Portuguese	LIGHT (WEIGHT)	leve	leve	l ɛ v ɨ				
3072	Spanish	LIGHT (WEIGHT)	liviano; ligero	liviano	l i β j a n o				
3073	Spanish	LIGHT (WEIGHT)	liviano; ligero	ligero	l i x ɛ ɾ o				
4606	Yaqui	LIGHT (WEIGHT)	kaa bette	kaa_bette	k aː + b e t t e		5. no evidence for borrowing	0.0	
5922	ZinacantanTzotzil	LIGHT (WEIGHT)	sipson	sipson	s i p s o n		5. no evidence for borrowing	0.0	
7578	Qeqchi	LIGHT (WEIGHT)	poy	poy	p o j		5. no evidence for borrowing	0.0	
7579	Qeqchi	LIGHT (WEIGHT)	seeb'	seeb'	s eː ɓ		5. no evidence for borrowing	0.0	
9636	Otomi	LIGHT (WEIGHT)	hingi hu	hingi_hu	h i n g i + h u		5. no evidence for borrowing	0.0	
9637	Otomi	LIGHT (WEIGHT)	xitho	xitho	x i θ o		5. no evidence for borrowing	0.0	
11087	ImbaburaQuechua	LIGHT (WEIGHT)	fangalla (2)	fangalla	ɸ a ŋ g a ʒ a		5. no evidence for borrowing	0.0	
67	Portuguese	LIGHTNING	relâmpago	relâmpago	ʁ ɨ l ɐ̃ p ɐ ɡ u				
1746	Spanish	LIGHTNING	relámpago	relámpago	r e l a m p a ɣ o				
3498	Yaqui	LIGHTNING	yuku be’oktia	yuku_be’oktia	j u k u + b e ʔ o k t i a		5. no evidence for borrowing	0.0	
4929	ZinacantanTzotzil	LIGHTNING	saktzeul	saktzeul	s a k tsʰ e u l		5. no evidence for borrowing	0.0	
4930	ZinacantanTzotzil	LIGHTNING	chauk	chauk	tʃʰ a u k		5. no evidence for borrowing	0.0	
6196	Qeqchi	LIGHTNING	raq’kaaq	raq’kaaq	r a qʼ k aː qʰ		5. no evidence for borrowing	0.0	
6197	Qeqchi	LIGHTNING	lemskaaq	lemskaaq	l e m s k aː qʰ		5. no evidence for borrowing	0.0	
6198	Qeqchi	LIGHTNING	xrepom kaaq	xrepom_kaaq	ʃ ɾ e p o m + k aː qʰ		5. no evidence for borrowing	0.0	
6199	Qeqchi	LIGHTNING	repom	repom	r e p o m		5. no evidence for borrowing	0.0	
7981	Otomi	LIGHTNING	jwe̲i	jwe̲i	xʷ æ i		5. no evidence for borrowing	0.0	
10200	ImbaburaQuechua	LIGHTNING	rilampagu	rilampagu	ʐ i l a m b a g u		1. clearly borrowed	1.0	
949	Portuguese	LIMP	coxear	coxear	k u ʃ i a ɾ				
2664	Spanish	LIMP	lisiar	lisiar	l i s j a ɾ				
4261	Yaqui	LIMP	ro’ite	ro’ite	r o ʔ i t e		5. no evidence for borrowing	0.0	
5635	ZinacantanTzotzil	LIMP	koshkonah	koshkonah	k o ʃ k o n a h		5. no evidence for borrowing	0.0	kosh is from Spanish cojo ‘lame’
5636	ZinacantanTzotzil	LIMP	lit’lonah	lit’lonah	l i tʼ l o n a h		5. no evidence for borrowing	0.0	
5637	ZinacantanTzotzil	LIMP	pehponah	pehponah	pʰ e h p o n a h		5. no evidence for borrowing	0.0	
9112	Otomi	LIMP	nk'u̲'mi	nk'u̲'mi	n kʼ u ˀm i		5. no evidence for borrowing	0.0	
9113	Otomi	LIMP	nk'u̲ts'i	nk'u̲ts'i	n kʼ u tsʼ i		5. no evidence for borrowing	0.0	
10813	ImbaburaQuechua	LIMP	lisyana	lisyana	l i s j a n a		1. clearly borrowed	1.0	
1160	Portuguese	LINE	linha	linha	l i ɲ ɐ				
2893	Spanish	LINE	línea	línea	l i n e a				
4441	Yaqui	LINE	wii’i	wii’i	w iː ʔ i		5. no evidence for borrowing	0.0	
7375	Qeqchi	LINE	linea	linea	l i n e a		1. clearly borrowed	1.0	
9397	Otomi	LINE	raya	raya	r a j a		1. clearly borrowed	1.0	
9398	Otomi	LINE	'ñu	'ñu	ˀɲ u		5. no evidence for borrowing	0.0	
10958	ImbaburaQuechua	LINE	wachu (1)	wachu	w a tʃ u		5. no evidence for borrowing	0.0	
271	Portuguese	LION	leão	leão	l j ɐ̃ũ				
1963	Spanish	LION	león	león	l e o n				
3682	Yaqui	LION	ousei	ousei	o u s e i		5. no evidence for borrowing	0.0	
5094	ZinacantanTzotzil	LION	leon	leon	l e o n		1. clearly borrowed	1.0	
6401	Qeqchi	LION	kaq koj	kaq_koj	k a q + k o x		5. no evidence for borrowing	0.0	
8260	Otomi	LION	liyon	liyon	l i j o n		1. clearly borrowed	1.0	
10349	ImbaburaQuechua	LION	liyón	liyón	l i j o ŋ		1. clearly borrowed	1.0	
356	Portuguese	LIP	lábio	lábio	l a b j u				
2050	Spanish	LIP	labio	labio	l a β j o				
3761	Yaqui	LIP	tenberia	tenberia	t e n b e r i a		5. no evidence for borrowing	0.0	
5176	ZinacantanTzotzil	LIP	7anal 7eal	7anal_7eal	ʔ a n a l + ʔ e a l		5. no evidence for borrowing	0.0	
5177	ZinacantanTzotzil	LIP	pak’al 7eal	pak’al_7eal	pʰ a kʼ a l + ʔ e a l		5. no evidence for borrowing	0.0	
6497	Qeqchi	LIP	tz'uumal e	tz'uumal_e	tsʼ uː m a l + e		5. no evidence for borrowing	0.0	
8352	Otomi	LIP	xine	xine	x i n e		5. no evidence for borrowing	0.0	
10416	ImbaburaQuechua	LIP	shimi	shimi	ʃ i m i		5. no evidence for borrowing	0.0	
1295	Portuguese	LISTEN	escutar	escutar	ʃ k u t a ɾ				
3034	Spanish	LISTEN	escuchar	escuchar	ɛ s k u tʃ a ɾ				
4578	Yaqui	LISTEN	jikkaja	jikkaja	j i k k a j a		5. no evidence for borrowing	0.0	
5892	ZinacantanTzotzil	LISTEN	7a7i	7a7i	ʔ a ʔ i		5. no evidence for borrowing	0.0	
7534	Qeqchi	LISTEN	ab'ink	ab'ink	a ɓ i n kʰ		5. no evidence for borrowing	0.0	
9577	Otomi	LISTEN	o̲ts'e	o̲ts'e	ə tsʼ e		5. no evidence for borrowing	0.0	
11060	ImbaburaQuechua	LISTEN	uyana (2)	uyana	u j a n a		5. no evidence for borrowing	0.0	
398	Portuguese	LIVER	fígado	fígado	f i ɡ ɐ d u				
2094	Spanish	LIVER	hígado	hígado	i ɣ a ð o				
3804	Yaqui	LIVER	jeemam	jeemam	j eː m a m		5. no evidence for borrowing	0.0	
5222	ZinacantanTzotzil	LIVER	sekub	sekub	s e k u b		5. no evidence for borrowing	0.0	
6542	Qeqchi	LIVER	ch'och'	ch'och'	tʃʼ o tʃʼ		5. no evidence for borrowing	0.0	
8398	Otomi	LIVER	ya	ya	j a		5. no evidence for borrowing	0.0	
10454	ImbaburaQuechua	LIVER	yana shungu (1)	yana_shungu	j a n a + ʃ u ŋ g u		5. no evidence for borrowing	0.0	
197	Portuguese	LIVESTOCK	gado	gado	ɡ a d u				
1882	Spanish	LIVESTOCK	ganado	ganado	g a n a ð o				
3624	Yaqui	LIVESTOCK	wakasim	wakasim	w a k a s i m		1. clearly borrowed	1.0	waka-s-im,  -s = plural suffix from Spanish semantically opaque
6330	Qeqchi	LIVESTOCK	ketomj	ketomj	k e t o m x		5. no evidence for borrowing	0.0	
8163	Otomi	LIVESTOCK	me̲ti (1)	me̲ti	m æ t̪ i		5. no evidence for borrowing	0.0	
8164	Otomi	LIVESTOCK	'yo (1)	'yo	ˀj o		5. no evidence for borrowing	0.0	
10301	ImbaburaQuechua	LIVESTOCK	wagra	wagra	w a g ɾ a		5. no evidence for borrowing	0.0	
304	Portuguese	LIZARD	lagarto	lagarto	l ɐ ɡ a ɾ t u				
1999	Spanish	LIZARD	lagartija	lagartija	l a ɣ a ɾ t i x a				
3718	Yaqui	LIZARD	wikuim	wikuim	w i k u i m		5. no evidence for borrowing	0.0	
5128	ZinacantanTzotzil	LIZARD	patish	patish	pʰ a t i sʰ		2. probably borrowed	0.75	
5129	ZinacantanTzotzil	LIZARD	7okotz	7okotz	ʔ o k o tsʰ		5. no evidence for borrowing	0.0	
6450	Qeqchi	LIZARD	tolokok	tolokok	t o l o k o kʰ		2. probably borrowed	0.75	
8301	Otomi	LIZARD	korga	korga	k o r g a		5. no evidence for borrowing	0.0	
8302	Otomi	LIZARD	sandu̲ga	sandu̲ga	s a n d u g a		5. no evidence for borrowing	0.0	
8303	Otomi	LIZARD	tsathi	tsathi	ts a θ i		5. no evidence for borrowing	0.0	
10376	ImbaburaQuechua	LIZARD	palu kuku	palu_kuku	p a l u + k u k u		5. no evidence for borrowing	0.0	Clearly created on loan basis
693	Portuguese	LOCK	fechadura; cadeado	fechadura	f ɨ ʃ ɐ d u ɾ ɐ				
694	Portuguese	LOCK	fechadura; cadeado	cadeado	k ɐ d i a d u				
2389	Spanish	LOCK	cerradura; candado	cerradura	θ ɛ r a ð u ɾ a				
2390	Spanish	LOCK	cerradura; candado	candado	k a n d a ð o				
4060	Yaqui	LOCK	kanraom	kanraom	k a n r a o m		1. clearly borrowed	1.0	
5449	ZinacantanTzotzil	LOCK	k’oh te7	k’oh_te7	kʼ o h + t e ʔ		5. no evidence for borrowing	0.0	
6839	Qeqchi	LOCK	tz’apleb’	tz’apleb’	tsʼ a p l e ɓ		5. no evidence for borrowing	0.0	
6840	Qeqchi	LOCK	kantaaw	kantaaw	k a n t aː w		1. clearly borrowed	1.0	
8736	Otomi	LOCK	njot'i	njot'i	n x o t̪ʼ i		5. no evidence for borrowing	0.0	
1133	Portuguese	LONG	comprido	comprido	k õ p ɾ i d u				
2866	Spanish	LONG	largo	largo	l a ɾ ɣ o				
4421	Yaqui	LONG	teebe	teebe	t eː b e		5. no evidence for borrowing	0.0	
5764	ZinacantanTzotzil	LONG	bitzbitz	bitzbitz	ɓ i tsʰ ɓ i tsʰ		5. no evidence for borrowing	0.0	
5765	ZinacantanTzotzil	LONG	tz’upul	tz’upul	tsʼ u p u l		5. no evidence for borrowing	0.0	
5766	ZinacantanTzotzil	LONG	natil	natil	n a t i l		5. no evidence for borrowing	0.0	
5767	ZinacantanTzotzil	LONG	tintin	tintin	t i n t i n		5. no evidence for borrowing	0.0	
7324	Qeqchi	LONG	najt roq	najt_roq	n a x t + ɾ o qʰ		5. no evidence for borrowing	0.0	
7325	Qeqchi	LONG	nim xkelam	nim_xkelam	n i m + ʃ k e l a m		5. no evidence for borrowing	0.0	
7326	Qeqchi	LONG	jukuch	jukuch	x u k u tʃ		5. no evidence for borrowing	0.0	
7327	Qeqchi	LONG	lujuch	lujuch	l u x u tʃ		5. no evidence for borrowing	0.0	
9355	Otomi	LONG	xi ma	xi_ma	x i + m a		5. no evidence for borrowing	0.0	
9356	Otomi	LONG	xi maki	xi_maki	x i + m a k i		5. no evidence for borrowing	0.0	
10939	ImbaburaQuechua	LONG	suni	suni	s u n i		5. no evidence for borrowing	0.0	
1302	Portuguese	LOOK	olhar para; fitar	olhar para	<<o>> <<l>> <<h>> <<a>> <<r>> + <<p>> <<a>> <<r>> <<a>>				
1303	Portuguese	LOOK	olhar para; fitar	fitar	f i t a ɾ				
3042	Spanish	LOOK	mirar; contemplar	mirar	m i ɾ a ɾ				
3043	Spanish	LOOK	mirar; contemplar	contemplar	k o n t e m p l a ɾ				
4582	Yaqui	LOOK	bitchu	bitchu	b i t tʃ u		5. no evidence for borrowing	0.0	
5897	ZinacantanTzotzil	LOOK	k’e	k’e	kʼ e		5. no evidence for borrowing	0.0	
7540	Qeqchi	LOOK	ka’yank	ka’yank	k a ʔ j a n kʰ		5. no evidence for borrowing	0.0	
9591	Otomi	LOOK	handi	handi	h a n d i		5. no evidence for borrowing	0.0	
9592	Otomi	LOOK	he'mi	he'mi	h e ˀm i		5. no evidence for borrowing	0.0	
9593	Otomi	LOOK	no̲ts'e	no̲ts'e	n ə tsʼ e		5. no evidence for borrowing	0.0	
11064	ImbaburaQuechua	LOOK	rikuna (2)	rikuna	ʐ i k u n a		5. no evidence for borrowing	0.0	
1030	Portuguese	LOOK FOR	buscar; procurar	buscar	b u ʃ k a ɾ				
1031	Portuguese	LOOK FOR	buscar; procurar	procurar	p ɾ u k u ɾ a ɾ				
2752	Spanish	LOOK FOR	buscar	buscar	b u s k a ɾ				
4333	Yaqui	LOOK FOR	jariwa	jariwa	j a r i w a		5. no evidence for borrowing	0.0	
5686	ZinacantanTzotzil	LOOK FOR	sa7	sa7	s a ʔ		5. no evidence for borrowing	0.0	
7208	Qeqchi	LOOK FOR	sik'ok	sik'ok	s i kʼ o kʰ		5. no evidence for borrowing	0.0	
9227	Otomi	LOOK FOR	honi	honi	h o n i		5. no evidence for borrowing	0.0	
10863	ImbaburaQuechua	LOOK FOR	maskana	maskana	m a s k a n a		5. no evidence for borrowing	0.0	
619	Portuguese	LOOM	tear	tear	t i a ɾ				
2311	Spanish	LOOM	telar	telar	t e l a ɾ				
3993	Yaqui	LOOM	wikiata joowa’apo	wikiata_joowa’apo	w i k i a t a + j oː w a ʔ a p o		5. no evidence for borrowing	0.0	
5408	ZinacantanTzotzil	LOOM	holobil	holobil	h o l o ɓ i l		5. no evidence for borrowing	0.0	
6773	Qeqchi	LOOM	kemleb'	kemleb'	k e m l e ɓ		5. no evidence for borrowing	0.0	
8645	Otomi	LOOM	'be	'be	ˀb e		5. no evidence for borrowing	0.0	
10604	ImbaburaQuechua	LOOM	tilar	tilar	t i l a ɾ		1. clearly borrowed	1.0	
1298	Portuguese	LOUD	ruidoso; barulhento	ruidoso	ʁ ui d ɔ z u				
1299	Portuguese	LOUD	ruidoso; barulhento	barulhento	b ɐ ɾ u ʎ ẽ t u				
3037	Spanish	LOUD	alta (voz); ruidoso	alta	a l t a				
3038	Spanish	LOUD	alta (voz); ruidoso	ruidoso	r w i ð o s o				
4580	Yaqui	LOUD	jaiti jiia	jaiti_jiia	j a i t i + j iː a		5. no evidence for borrowing	0.0	
5893	ZinacantanTzotzil	LOUD	tzotz (2)	tzotz	tsʰ o tsʰ		5. no evidence for borrowing	0.0	
7537	Qeqchi	LOUD	kaw	kaw	k a w		5. no evidence for borrowing	0.0	
7538	Qeqchi	LOUD	kaw xyaab'	kaw_xyaab'	k a w + ʃ j aː ɓ		5. no evidence for borrowing	0.0	
9588	Otomi	LOUD	nts’e̲di	nts’e̲di	n tsʼ æ d i		5. no evidence for borrowing	0.0	
11062	ImbaburaQuechua	LOUD	sinchi rimay	sinchi_rimay	s i n dʒ i + ɾ i m a j		5. no evidence for borrowing	0.0	
279	Portuguese	LOUSE	piolho	piolho	p j ɔ ʎ u				
1973	Spanish	LOUSE	piojo	piojo	p j o x o				
1358	Portuguese	LOVE	amar	amar	ɐ m a ɾ				
3095	Spanish	LOVE	querer, amar	querer	k ɛ ɾ ɛ ɾ				
3096	Spanish	LOVE	querer, amar	amar	a m a ɾ				
4622	Yaqui	LOVE	waata	waata	w aː t a		5. no evidence for borrowing	0.0	
5936	ZinacantanTzotzil	LOVE	k’an	k’an	kʼ a n		5. no evidence for borrowing	0.0	
7605	Qeqchi	LOVE	rahok	rahok	r a h o kʰ		5. no evidence for borrowing	0.0	
7606	Qeqchi	LOVE	oxloq'ink	oxloq'ink	o ʃ l o qʼ i n kʰ		5. no evidence for borrowing	0.0	
9658	Otomi	LOVE	ne (2)	ne	n e		5. no evidence for borrowing	0.0	
9659	Otomi	LOVE	mädi	mädi	m ɐ d i		5. no evidence for borrowing	0.0	
11103	ImbaburaQuechua	LOVE	juyana	juyana	x u j a n a		5. no evidence for borrowing	0.0	
1103	Portuguese	LOW	baixo	baixo	b ai ʃ u				
2836	Spanish	LOW	bajo	bajo	b a x o				
4396	Yaqui	LOW	ko’ome’ela	ko’ome’ela	k o ʔ o m e ʔ e l a		5. no evidence for borrowing	0.0	
5741	ZinacantanTzotzil	LOW	pek’el	pek’el	pʰ e kʼ e l		5. no evidence for borrowing	0.0	
7292	Qeqchi	LOW	kach'in xteram	kach'in_xteram	k a tʃʼ i n + ʃ t e ɾ a m		5. no evidence for borrowing	0.0	
9325	Otomi	LOW	hingi hets'i	hingi_hets'i	h i n g i + h e tsʼ i		5. no evidence for borrowing	0.0	
9326	Otomi	LOW	mextha	mextha	m e x θ a		5. no evidence for borrowing	0.0	
10919	ImbaburaQuechua	LOW	uchilla	uchilla	u tʃ i ʒ a		5. no evidence for borrowing	0.0	
39	Portuguese	LOW TIDE	maré baixa; maré vazia	maré baixa	<<m>> <<a>> <<r>> <<é>> + <<b>> <<a>> <<i>> <<x>> <<a>>				
40	Portuguese	LOW TIDE	maré baixa; maré vazia	maré vazia	<<m>> <<a>> <<r>> <<é>> + <<v>> <<a>> <<z>> <<i>> <<a>>				
1723	Spanish	LOW TIDE	bajamar	bajamar	b a x a m a ɾ				
3480	Yaqui	LOW TIDE	sumia	sumia	s u m i a		5. no evidence for borrowing	0.0	
7962	Otomi	LOW TIDE	dehe hingi hets’i	dehe_hingi_hets’i	d e h e + h i n g i + h e tsʼ i		5. no evidence for borrowing	0.0	
547	Portuguese	LUNCH	almoço	almoço	a ɫ m ɔ s u				
2243	Spanish	LUNCH	almuerzo	almuerzo	a l m w ɛ ɾ θ o				
3926	Yaqui	LUNCH	ketwi bwa’ame	ketwi_bwa’ame	k e t w i + bʷ a ʔ a m e		5. no evidence for borrowing	0.0	
6702	Qeqchi	LUNCH	wa	wa	w a		5. no evidence for borrowing	0.0	
6703	Qeqchi	LUNCH	wa re wa'leb'	wa_re_wa'leb'	w a + ɾ e + w a ʔ l e ɓ		5. no evidence for borrowing	0.0	
8566	Otomi	LUNCH	nzimuxudi	nzimuxudi	n z i m u x u d i		5. no evidence for borrowing	0.0	
10550	ImbaburaQuechua	LUNCH	almuza	almuza	a l m u z a		1. clearly borrowed	1.0	
397	Portuguese	LUNG	pulmão	pulmão	p u ɫ m ɐ̃ũ				
2093	Spanish	LUNG	pulmón	pulmón	p u l m o n				
3803	Yaqui	LUNG	sare’echia	sare’echia	s a r e ʔ e tʃ i a		5. no evidence for borrowing	0.0	
6541	Qeqchi	LUNG	pospo'oy	pospo'oy	p o s p o ʔ o j		5. no evidence for borrowing	0.0	
8397	Otomi	LUNG	pulmon	pulmon	p u l m o n		1. clearly borrowed	1.0	
10453	ImbaburaQuechua	LUNG	yurak shungu	yurak_shungu	j u ɾ a k + ʃ u ŋ g u		5. no evidence for borrowing	0.0	
1423	Portuguese	MAD	louco; maluco	louco	l o k u				
1424	Portuguese	MAD	louco; maluco	maluco	m ɐ l u k u				
3177	Spanish	MAD	loco; insano	loco	l o k o				
3178	Spanish	MAD	loco; insano	insano	i n s a n o				
4676	Yaqui	MAD	kaa suak	kaa_suak	k aː + s u a k		5. no evidence for borrowing	0.0	
7678	Qeqchi	MAD	wax ru	wax_ru	w a ʃ + ɾ u		2. probably borrowed	0.75	
7679	Qeqchi	MAD	look	look	l oː kʰ		1. clearly borrowed	1.0	
7680	Qeqchi	MAD	kaan ru	kaan_ru	k aː n + ɾ u		5. no evidence for borrowing	0.0	
9759	Otomi	MAD	'be̲mfeni	'be̲mfeni	ˀb æ m f e n i		5. no evidence for borrowing	0.0	
9760	Otomi	MAD	dondo	dondo	d o n d o		1. clearly borrowed	1.0	
11152	ImbaburaQuechua	MAD	yuyay chingashka	yuyay_chingashka	j u j a j + tʃ i ŋ g a ʃ k a		5. no evidence for borrowing	0.0	
1675	Portuguese	MAGIC	magia; feitiçaria	magia	m ɐ ʒ i ɐ				
1676	Portuguese	MAGIC	magia; feitiçaria	feitiçaria	f ɐi t i s ɐ ɾ i ɐ				
3444	Spanish	MAGIC	brujería; hechicería	brujería	b ɾ u x ɛ ɾ i a				
3445	Spanish	MAGIC	brujería; hechicería	hechicería	e tʃ i θ ɛ ɾ i a				
4880	Yaqui	MAGIC	yee sisibowame	yee_sisibowame	j eː + s i s i b o w a m e		5. no evidence for borrowing	0.0	
7917	Qeqchi	MAGIC	tuul	tuul	t uː l		5. no evidence for borrowing	0.0	
10156	Otomi	MAGIC	t'ete	t'ete	t̪ʼ e t̪ e		5. no evidence for borrowing	0.0	
11317	ImbaburaQuechua	MAGIC	brujyana	brujyana	b ɾ u x j a n a		1. clearly borrowed	1.0	
1677	Portuguese	MAGICIAN	feiticeiro; bruxo/ bruxa	feiticeiro	f ɐi t i s ɐi ɾ u				
1678	Portuguese	MAGICIAN	feiticeiro; bruxo/ bruxa	bruxo	b ɾ u ʃ u				
1679	Portuguese	MAGICIAN	feiticeiro; bruxo/ bruxa	bruxa	b ɾ u ʃ ɐ				
3446	Spanish	MAGICIAN	brujo/ bruja; hechicero	brujo	b ɾ u x o				
3447	Spanish	MAGICIAN	brujo/ bruja; hechicero	bruja	b ɾ u x a				
3448	Spanish	MAGICIAN	brujo/ bruja; hechicero	hechicero	e tʃ i θ ɛ ɾ o				
4881	Yaqui	MAGICIAN	yee sisibome	yee_sisibome	j eː + s i s i b o m e		5. no evidence for borrowing	0.0	
6146	ZinacantanTzotzil	MAGICIAN	pukuh	pukuh	pʰ u k u h		5. no evidence for borrowing	0.0	
6147	ZinacantanTzotzil	MAGICIAN	h7ak’-chamel	h7ak’-chamel	h ʔ a kʼ + tʃʰ a m e l		5. no evidence for borrowing	0.0	
6148	ZinacantanTzotzil	MAGICIAN	htuch’7ora	htuch’7ora	h t u tʃʼ ʔ o ɾ a		5. no evidence for borrowing	0.0	7ora is from Spanish hora ‘hour’
6149	ZinacantanTzotzil	MAGICIAN	htuch’kantela	htuch’kantela	h t u tʃʼ k a n t e l a		5. no evidence for borrowing	0.0	kantela is from Spanish candela ‘candle’
7918	Qeqchi	MAGICIAN	awasinel	awasinel	a w a s i n e l		5. no evidence for borrowing	0.0	
7919	Qeqchi	MAGICIAN	tuulanel	tuulanel	t uː l a n e l		5. no evidence for borrowing	0.0	
10157	Otomi	MAGICIAN	ndo̲zne	ndo̲zne	n d ə z n e		5. no evidence for borrowing	0.0	
10158	Otomi	MAGICIAN	tsuzne	tsuzne	ts u z n e		5. no evidence for borrowing	0.0	
10159	Otomi	MAGICIAN	'ñete	'ñete	ˀɲ e t̪ e		5. no evidence for borrowing	0.0	
10160	Otomi	MAGICIAN	'ñete 'be̲hñä	'ñete_'be̲hñä	ˀɲ e t̪ e + ˀb æ h ɲ ɐ		5. no evidence for borrowing	0.0	
10161	Otomi	MAGICIAN	'ñete 'ño̲ho̲	'ñete_'ño̲ho̲	ˀɲ e t̪ e + ˀɲ ə h ə		5. no evidence for borrowing	0.0	
11318	ImbaburaQuechua	MAGICIAN	bruju	bruju	b ɾ u x u		1. clearly borrowed	1.0	
18	Portuguese	MAINLAND	terra firme	terra firme	<<t>> <<e>> <<r>> <<r>> <<a>> + <<f>> <<i>> <<r>> <<m>> <<e>>				
1700	Spanish	MAINLAND	continente; tierra firme	continente	k o n t i n e n t e				
1701	Spanish	MAINLAND	continente; tierra firme	tierra firme	<<t>> <<i>> <<e>> <<r>> <<r>> <<a>> + <<f>> <<i>> <<r>> <<m>> <<e>>				
3465	Yaqui	MAINLAND	kontinente	kontinente	k o n t i n e n t e		1. clearly borrowed	1.0	
6165	Qeqchi	MAINLAND	kontineent	kontineent	k o n t i n eː n tʰ		1. clearly borrowed	1.0	
7940	Otomi	MAINLAND	ximhai	ximhai	x i mʰ a i		5. no evidence for borrowing	0.0	
7941	Otomi	MAINLAND	hai	hai	h a i		5. no evidence for borrowing	0.0	
769	Portuguese	MAIZE	milho	milho	m i ʎ u				
2468	Spanish	MAIZE	maíz	maíz	m a i θ				
4114	Yaqui	MAIZE	bachi	bachi	b a tʃ i		5. no evidence for borrowing	0.0	
5497	ZinacantanTzotzil	MAIZE	7ishim	7ishim	ʔ i ʃ i m		5. no evidence for borrowing	0.0	
6911	Qeqchi	MAIZE	ixim	ixim	i ʃ i m		5. no evidence for borrowing	0.0	
8826	Otomi	MAIZE	de̲thä	de̲thä	d æ θ ɐ		5. no evidence for borrowing	0.0	
8827	Otomi	MAIZE	thä	thä	θ ɐ		5. no evidence for borrowing	0.0	
10696	ImbaburaQuechua	MAIZE	sara	sara	s a ɾ a		5. no evidence for borrowing	0.0	
195	Portuguese	MALE (OF ANIMAL)	masculino	masculino	m ɐ ʃ k u l i n u				
1878	Spanish	MALE (OF ANIMAL)	masculino; macho	masculino	m a s k u l i n o				
1879	Spanish	MALE (OF ANIMAL)	masculino; macho	macho	m a tʃ o				
3622	Yaqui	MALE (OF ANIMAL)	o’ou	o’ou	o ʔ o u		5. no evidence for borrowing	0.0	
5036	ZinacantanTzotzil	MALE (OF ANIMAL)	tot _______________	tot________________	t o t		5. no evidence for borrowing	0.0	
6328	Qeqchi	MALE (OF ANIMAL)	k’ol	k’ol	kʼ o l		5. no evidence for borrowing	0.0	
8161	Otomi	MALE (OF ANIMAL)	ndo̲	ndo̲	n d ə		5. no evidence for borrowing	0.0	
10299	ImbaburaQuechua	MALE (OF ANIMAL)	kari	kari	k a ɾ i		5. no evidence for borrowing	0.0	
104	Portuguese	MALE (OF PERSON)	macho	macho	m a ʃ u				
1784	Spanish	MALE (OF PERSON)	varón; macho	varón	b a ɾ o n				
1785	Spanish	MALE (OF PERSON)	varón; macho	macho	m a tʃ o				
3531	Yaqui	MALE (OF PERSON)	o’ou	o’ou	o ʔ o u		5. no evidence for borrowing	0.0	
6238	Qeqchi	MALE (OF PERSON)	teelom	teelom	t eː l o m		2. probably borrowed	0.75	
8024	Otomi	MALE (OF PERSON)	‘ño̲ho̲	‘ño̲ho̲	ˀɲ ə h ə		5. no evidence for borrowing	0.0	
10231	ImbaburaQuechua	MALE (OF PERSON)	kari (2)	kari	k a ɾ i		5. no evidence for borrowing	0.0	
217	Portuguese	MALE GOAT	bode	bode	b ɔ d ɨ				
1908	Spanish	MALE GOAT	chivo; macho cabrío	chivo	tʃ i β o				
1909	Spanish	MALE GOAT	chivo; macho cabrío	macho cabrío	<<m>> <<a>> <<c>> <<h>> <<o>> + <<c>> <<a>> <<b>> <<r>> <<í>> <<o>>				
3642	Yaqui	MALE GOAT	kabaa	kabaa	k a b aː		1. clearly borrowed	1.0	
6352	Qeqchi	MALE GOAT	chib’aat	chib’aat	tʃ i ɓ aː tʰ		1. clearly borrowed	1.0	
8194	Otomi	MALE GOAT	ndo̲t'äxi	ndo̲t'äxi	n d ə t̪ʼ ɐ x i		5. no evidence for borrowing	0.0	
10318	ImbaburaQuechua	MALE GOAT	chita	chita	tʃ i t a		2. probably borrowed	0.75	
102	Portuguese	MAN	homem	homem	ɔ m ɐ̃ĩ				
1782	Spanish	MAN	hombre	hombre	o m b ɾ e				
3529	Yaqui	MAN	o’ou	o’ou	o ʔ o u		5. no evidence for borrowing	0.0	
4964	ZinacantanTzotzil	MAN	mol	mol	m o l		5. no evidence for borrowing	0.0	
4965	ZinacantanTzotzil	MAN	vinik	vinik	v i n i k		5. no evidence for borrowing	0.0	
6235	Qeqchi	MAN	teelom	teelom	t eː l o m		2. probably borrowed	0.75	
6236	Qeqchi	MAN	winq	winq	w i n qʰ		5. no evidence for borrowing	0.0	
8022	Otomi	MAN	'ño̲ho̲	'ño̲ho̲	ˀɲ ə h ə		5. no evidence for borrowing	0.0	
10229	ImbaburaQuechua	MAN	kari (1)	kari	k a ɾ i		5. no evidence for borrowing	0.0	
1451	Portuguese	MANNER	maneira	maneira	m ɐ n ɐi ɾ ɐ				
3208	Spanish	MANNER	modo; manera	modo	m o ð o				
3209	Spanish	MANNER	modo; manera	manera	m a n ɛ ɾ a				
7706	Qeqchi	MANNER	naraj	naraj	n a ɾ a x		5. no evidence for borrowing	0.0	
9808	Otomi	MANNER	komongu	komongu	k o m o n g u		1. clearly borrowed	1.0	
9809	Otomi	MANNER	komu̲	komu̲	k o m u		1. clearly borrowed	1.0	
9810	Otomi	MANNER	njangu	njangu	n x a n g u		5. no evidence for borrowing	0.0	
9811	Otomi	MANNER	jangu	jangu	x a n g u		5. no evidence for borrowing	0.0	
11174	ImbaburaQuechua	MANNER	shina	shina	ʃ i n a		5. no evidence for borrowing	0.0	
1188	Portuguese	MANY	muito, muitos	muito	m ũ j t u				
1189	Portuguese	MANY	muito, muitos	muitos	m ũ j t u ʃ				
2921	Spanish	MANY	mucho	mucho	m u tʃ o				
4478	Yaqui	MANY	ousi	ousi	o u s i		5. no evidence for borrowing	0.0	
