ID	DOCULECT	CONCEPT	VALUE	FORM	TOKENS	NOTE	BORROWED	BORROWED_SCORE	BORROWED_BASE
8253	Otomi	SHELL	xeni	xeni	x e n i		5. no evidence for borrowing	0.0	
8254	Otomi	SHELL	tsi’buxi	tsi’buxi	ts i ʔ b u x i		5. no evidence for borrowing	0.0	
1590	Portuguese	SHIELD	escudo	escudo	ʃ k u d u				
3355	Spanish	SHIELD	escudo	escudo	ɛ s k u ð o				
7830	Qeqchi	SHIELD	lak’am, lakam	lak’am	l a kʼ a m		2. probably borrowed	0.75	
10026	Otomi	SHIELD	ñänte	ñänte	ɲ ɐ n t̪ e		5. no evidence for borrowing	0.0	
10027	Otomi	SHIELD	nxu̲ni (2)	nxu̲ni	n x u n i		5. no evidence for borrowing	0.0	
10028	Otomi	SHIELD	'ma̲i	'ma̲i	ˀm ɔ i		5. no evidence for borrowing	0.0	
11266	ImbaburaQuechua	SHIELD	unancha	unancha	u n a n dʒ a		5. no evidence for borrowing	0.0	
1305	Portuguese	SHINE	brilhar	brilhar	b ɾ i ʎ a ɾ				
3046	Spanish	SHINE	brillar	brillar	b ɾ i ʎ a ɾ				
4584	Yaqui	SHINE	beojtachichi’ite	beojtachichi’ite	b e o j t a tʃ i tʃ i ʔ i t e		5. no evidence for borrowing	0.0	
7542	Qeqchi	SHINE	lemlotk	lemlotk	l e m l o t kʰ		5. no evidence for borrowing	0.0	
9596	Otomi	SHINE	jwe̲ts'i	jwe̲ts'i	xʷ æ tsʼ i		5. no evidence for borrowing	0.0	
9597	Otomi	SHINE	jwe̲ti	jwe̲ti	xʷ æ t̪ i		5. no evidence for borrowing	0.0	
9598	Otomi	SHINE	jwe̲xki	jwe̲xki	xʷ æ x k i		5. no evidence for borrowing	0.0	
11066	ImbaburaQuechua	SHINE	punchashayana	punchashayana	p u n dʒ a ʃ a j a n a		5. no evidence for borrowing	0.0	
994	Portuguese	SHIP	navio	navio	n a v j u				
2711	Spanish	SHIP	buque; barco	buque	b u k e				
2712	Spanish	SHIP	buque; barco	barco	b a ɾ k o				
4301	Yaqui	SHIP	bajut	bajut	b a j u t		5. no evidence for borrowing	0.0	
4302	Yaqui	SHIP	barko	barko	b a r k o		1. clearly borrowed	1.0	
7179	Qeqchi	SHIP	b’arko	b’arko	ɓ a ɾ k o		1. clearly borrowed	1.0	
7180	Qeqchi	SHIP	mama’ jukub’	mama’_jukub’	m a m a ʔ + x u k u ɓ		5. no evidence for borrowing	0.0	
9183	Otomi	SHIP	motsa dehe	motsa_dehe	m o ts a + d e h e		5. no evidence for borrowing	0.0	
9184	Otomi	SHIP	bojä dehe	bojä_dehe	b o x ɐ + d e h e		5. no evidence for borrowing	0.0	
9185	Otomi	SHIP	barko	barko	b a r k o		1. clearly borrowed	1.0	
633	Portuguese	SHIRT	camisa	camisa	k ɐ m i z ɐ				
2324	Spanish	SHIRT	camisa	camisa	k a m i s a				
4006	Yaqui	SHIRT	supem	supem	s u p e m		5. no evidence for borrowing	0.0	
5419	ZinacantanTzotzil	SHIRT	moketeil	moketeil	m o k e t e i l		5. no evidence for borrowing	0.0	
6787	Qeqchi	SHIRT	kamiis	kamiis	k a m iː s		1. clearly borrowed	1.0	
8663	Otomi	SHIRT	xayu	xayu	x a j u		5. no evidence for borrowing	0.0	
8664	Otomi	SHIRT	pahni	pahni	p a h n i		5. no evidence for borrowing	0.0	
10614	ImbaburaQuechua	SHIRT	kamiza	kamiza	k a m i z a		1. clearly borrowed	1.0	
434	Portuguese	SHIT (DEFECATE)	defecar	defecar	d ɨ f ɨ k a ɾ				
2131	Spanish	SHIT (DEFECATE)	defecar; excremento	defecar	d e f e k a ɾ				
2132	Spanish	SHIT (DEFECATE)	defecar; excremento	excremento	ɛ s k ɾ e m e n t o				
3837	Yaqui	SHIT (DEFECATE)	bwita	bwita	bʷ i t a		5. no evidence for borrowing	0.0	
5258	ZinacantanTzotzil	SHIT (DEFECATE)	tza’an	tza’an	tsʰ a ʔ a n		5. no evidence for borrowing	0.0	
5259	ZinacantanTzotzil	SHIT (DEFECATE)	ch’ay ba	ch’ay_ba	tʃʼ a j + ɓ a		5. no evidence for borrowing	0.0	
6590	Qeqchi	SHIT (DEFECATE)	k'otak	k'otak	k ʔ o t a kʰ		4. very little evidence for borrowing	0.25	
6591	Qeqchi	SHIT (DEFECATE)	tz'eqok ib'	tz'eqok_ib'	tsʼ e q o k + i ɓ		5. no evidence for borrowing	0.0	
8436	Otomi	SHIT (DEFECATE)	poho (1)	poho	p o h o		5. no evidence for borrowing	0.0	
10480	ImbaburaQuechua	SHIT (DEFECATE)	ismana	ismana	i s m a n a		5. no evidence for borrowing	0.0	
436	Portuguese	SHIVER	tiritar; tremer	tiritar	t i ɾ i t a ɾ				
437	Portuguese	SHIVER	tiritar; tremer	tremer	t ɾ ɨ m e ɾ				
2134	Spanish	SHIVER	temblar	temblar	t e m b l a ɾ				
3840	Yaqui	SHIVER	emo yooa	emo_yooa	e m o + j oː a		5. no evidence for borrowing	0.0	
5262	ZinacantanTzotzil	SHIVER	nik	nik	n i k		5. no evidence for borrowing	0.0	
6593	Qeqchi	SHIVER	parpotk	parpotk	p a ɾ p o t kʰ		5. no evidence for borrowing	0.0	
6594	Qeqchi	SHIVER	siksotk	siksotk	s i k s o t kʰ		5. no evidence for borrowing	0.0	
8440	Otomi	SHIVER	bi	bi	b i		5. no evidence for borrowing	0.0	
8441	Otomi	SHIVER	bit'i	bit'i	b i t̪ʼ i		5. no evidence for borrowing	0.0	
8442	Otomi	SHIVER	nhwät'i	nhwät'i	nʷʰ ɐ t̪ʼ i		5. no evidence for borrowing	0.0	
10482	ImbaburaQuechua	SHIVER	chujchuna	chujchuna	tʃ u x tʃ u n a		5. no evidence for borrowing	0.0	
641	Portuguese	SHOE	sapato	sapato	s ɐ p a t u				
2332	Spanish	SHOE	zapato	zapato	θ a p a t o				
4015	Yaqui	SHOE	boocham	boocham	b oː tʃ a m		1. clearly borrowed	1.0	
5423	ZinacantanTzotzil	SHOE	sapato	sapato	s a p a t o		1. clearly borrowed	1.0	
6795	Qeqchi	SHOE	xaab’	xaab’	ʃ aː ɓ		5. no evidence for borrowing	0.0	
8671	Otomi	SHOE	ze̲xthi	ze̲xthi	z æ x θ i		5. no evidence for borrowing	0.0	
10619	ImbaburaQuechua	SHOE	ushuta	ushuta	u ʃ u t a		5. no evidence for borrowing	0.0	
643	Portuguese	SHOEMAKER	sapateiro	sapateiro	s ɐ p ɐ t ɐi ɾ u				
2334	Spanish	SHOEMAKER	zapatero	zapatero	θ a p a t ɛ ɾ o				
4017	Yaqui	SHOEMAKER	sapateo	sapateo	s a p a t e o		1. clearly borrowed	1.0	-eo = Spanish agentivizer suffix -ero.
4018	Yaqui	SHOEMAKER	bochareo	bochareo	b o tʃ a r e o		1. clearly borrowed	1.0	boocham ‘shoes plus -reo < Spanish agentivizer suffix. The word in Yaqui is unanalyzable.
6797	Qeqchi	SHOEMAKER	aj yiib’om xaab’	aj_yiib’om_xaab’	a x + j iː ɓ o m + ʃ aː ɓ		5. no evidence for borrowing	0.0	
8674	Otomi	SHOEMAKER	mot’uzexthi	mot’uzexthi	m o t̪ʼ u z e x θ i		5. no evidence for borrowing	0.0	
8675	Otomi	SHOEMAKER	mazexthi	mazexthi	m a z e x θ i		5. no evidence for borrowing	0.0	
1615	Portuguese	SHOOT	disparar; fuzilar	disparar	d i ʃ p ɐ ɾ a ɾ				
1616	Portuguese	SHOOT	disparar; fuzilar	fuzilar	f u z i l a ɾ				
3383	Spanish	SHOOT	tirar; disparar	tirar	t i ɾ a ɾ				
3384	Spanish	SHOOT	tirar; disparar	disparar	d i s p a ɾ a ɾ				
4828	Yaqui	SHOOT	pusilaroa	pusilaroa	p u s i l a r o a		1. clearly borrowed	1.0	
6107	ZinacantanTzotzil	SHOOT	lok’es bala	lok’es_bala	l o kʼ e s + ɓ a l a		5. no evidence for borrowing	0.0	
6108	ZinacantanTzotzil	SHOOT	lok’es tiro	lok’es_tiro	l o kʼ e s + t i ɾ o		5. no evidence for borrowing	0.0	
6109	ZinacantanTzotzil	SHOOT	nitbe bala	nitbe_bala	n i t ɓ e + ɓ a l a		5. no evidence for borrowing	0.0	
6110	ZinacantanTzotzil	SHOOT	vom ta bala	vom_ta_bala	v o m + t a + ɓ a l a		5. no evidence for borrowing	0.0	
7857	Qeqchi	SHOOT	puub'ank	puub'ank	p uː ɓ a n kʰ		5. no evidence for borrowing	0.0	
10073	Otomi	SHOOT	e̲i	e̲i	æ i		5. no evidence for borrowing	0.0	
10074	Otomi	SHOOT	k'ahni	k'ahni	k ʔ a h n i		5. no evidence for borrowing	0.0	
10075	Otomi	SHOOT	ät’i	ät’i	ɐ t̪ʼ i		5. no evidence for borrowing	0.0	
10076	Otomi	SHOOT	he̲gi	he̲gi	h æ g i		5. no evidence for borrowing	0.0	
11276	ImbaburaQuechua	SHOOT	shitana (2)	shitana	ʃ i t a n a		5. no evidence for borrowing	0.0	
19	Portuguese	SHORE	margem; costa; praia	margem	m a ɾ ʒ ɐ̃ĩ				
20	Portuguese	SHORE	margem; costa; praia	costa	k ɔ ʃ t ɐ				
21	Portuguese	SHORE	margem; costa; praia	praia	p ɾ ai ɐ				
1702	Spanish	SHORE	ribera; playa; costa	ribera	r i β ɛ ɾ a				
1703	Spanish	SHORE	ribera; playa; costa	playa	p l a ʝ a				
1704	Spanish	SHORE	ribera; playa; costa	costa	k o s t a				
3466	Yaqui	SHORE	bawe mayoa	bawe_mayoa	b a w e + m a j o a		5. no evidence for borrowing	0.0	
4903	ZinacantanTzotzil	SHORE	ti' _________	ti'__________	t i		5. no evidence for borrowing	0.0	
6166	Qeqchi	SHORE	chi re ha’	chi_re_ha’	tʃ i + ɾ e + h a ʔ		5. no evidence for borrowing	0.0	
7942	Otomi	SHORE	ñänthe	ñänthe	ɲ ɐ n θ e		5. no evidence for borrowing	0.0	
7943	Otomi	SHORE	nenthe	nenthe	n e n θ e		5. no evidence for borrowing	0.0	
7944	Otomi	SHORE	ñäni (2)	ñäni	ɲ ɐ n i		5. no evidence for borrowing	0.0	
7945	Otomi	SHORE	nengi	nengi	n e n g i		5. no evidence for borrowing	0.0	
10177	ImbaburaQuechua	SHORE	manya (2)	manya	m a n j a		5. no evidence for borrowing	0.0	
1135	Portuguese	SHORT	curto	curto	k u ɾ t u				
2868	Spanish	SHORT	corto	corto	k o ɾ t o				
4423	Yaqui	SHORT	pochilai	pochilai	p o tʃ i l a i		5. no evidence for borrowing	0.0	
5770	ZinacantanTzotzil	SHORT	tzapo	tzapo	tsʰ a p o		3. perhaps borrowed	0.5	
7334	Qeqchi	SHORT	tupus roq	tupus_roq	t u p u s + ɾ o qʰ		5. no evidence for borrowing	0.0	
7335	Qeqchi	SHORT	kach'in xteram	kach'in_xteram	k a tʃʼ i n + ʃ t e ɾ a m		5. no evidence for borrowing	0.0	
7336	Qeqchi	SHORT	kach'in roq	kach'in_roq	k a tʃʼ i n + ɾ o qʰ		5. no evidence for borrowing	0.0	
7337	Qeqchi	SHORT	ch'ot	ch'ot	tʃʼ o tʰ		5. no evidence for borrowing	0.0	
9360	Otomi	SHORT	hingi ma	hingi_ma	h i n g i + m a		5. no evidence for borrowing	0.0	
9361	Otomi	SHORT	ar dozu	ar_dozu	a r + d o z u		5. no evidence for borrowing	0.0	
9362	Otomi	SHORT	ta txu̲tx'u̲lo	ta_txu̲tx'u̲lo	t̪ a + t̪ x u t̪ x ʔ u l o		5. no evidence for borrowing	0.0	
9363	Otomi	SHORT	xi tx'u̲ki	xi_tx'u̲ki	x i + t̪ x ʔ u k i		5. no evidence for borrowing	0.0	
9364	Otomi	SHORT	nkohi	nkohi	n k o h i		5. no evidence for borrowing	0.0	
10941	ImbaburaQuechua	SHORT	uchilla	uchilla	u tʃ i ʒ a		5. no evidence for borrowing	0.0	
364	Portuguese	SHOULDER	ombro	ombro	õ b ɾ u				
2059	Spanish	SHOULDER	hombro	hombro	o m b ɾ o				
3770	Yaqui	SHOULDER	jenom	jenom	j e n o m		5. no evidence for borrowing	0.0	
5186	ZinacantanTzotzil	SHOULDER	nekebal	nekebal	n e k e ɓ a l		5. no evidence for borrowing	0.0	
6508	Qeqchi	SHOULDER	xb’een tel	xb’een_tel	ʃ ɓ eː n + t e l		5. no evidence for borrowing	0.0	
8361	Otomi	SHOULDER	xi'xi	xi'xi	x i ˀx i		5. no evidence for borrowing	0.0	
10424	ImbaburaQuechua	SHOULDER	umbru	umbru	u m b ɾ u		1. clearly borrowed	1.0	
365	Portuguese	SHOULDERBLADE	omoplata	omoplata	o m u p l a t ɐ				
2060	Spanish	SHOULDERBLADE	escápula; omóplato	escápula	ɛ s k a p u l a				
2061	Spanish	SHOULDERBLADE	escápula; omóplato	omóplato	o m o p l a t o				
3771	Yaqui	SHOULDERBLADE	omooplato	omooplato	o m oː p l a t o		1. clearly borrowed	1.0	
3772	Yaqui	SHOULDERBLADE	paleetam	paleetam	p a l eː t a m		1. clearly borrowed	1.0	
6509	Qeqchi	SHOULDERBLADE	b'aqel xb'een tel	b'aqel_xb'een_tel	ɓ a q e l + ʃ ɓ eː n + t e l		5. no evidence for borrowing	0.0	
8362	Otomi	SHOULDERBLADE	nxi'ñe	nxi'ñe	n x i ˀɲ e		5. no evidence for borrowing	0.0	
10425	ImbaburaQuechua	SHOULDERBLADE	pillischaka	pillischaka	p i ʒ i s tʃ a k a		5. no evidence for borrowing	0.0	
1471	Portuguese	SHOUT	gritar	gritar	ɡ ɾ i t a ɾ				
3229	Spanish	SHOUT	gritar	gritar	g ɾ i t a ɾ				
4722	Yaqui	SHOUT	chaae	chaae	tʃ aː e		5. no evidence for borrowing	0.0	
6029	ZinacantanTzotzil	SHOUT	7avan	7avan	ʔ a v a n		5. no evidence for borrowing	0.0	
7727	Qeqchi	SHOUT	q'ichok e	q'ichok_e	qʼ i tʃ o k + e		3. perhaps borrowed	0.5	
7728	Qeqchi	SHOUT	chajok e	chajok_e	tʃ a x o k + e		5. no evidence for borrowing	0.0	
9848	Otomi	SHOUT	mafi	mafi	m a f i		5. no evidence for borrowing	0.0	
9849	Otomi	SHOUT	mahni	mahni	m a h n i		5. no evidence for borrowing	0.0	
9850	Otomi	SHOUT	mat'i	mat'i	m a t̪ʼ i		5. no evidence for borrowing	0.0	
9851	Otomi	SHOUT	nwe̲t'i	nwe̲t'i	nʷ æ t̪ʼ i		5. no evidence for borrowing	0.0	
11192	ImbaburaQuechua	SHOUT	kaparina	kaparina	k a p a ɾ i n a		5. no evidence for borrowing	0.0	
750	Portuguese	SHOVEL	pá	pá	p a				
2444	Spanish	SHOVEL	pala	pala	p a l a				
4099	Yaqui	SHOVEL	paalam	paalam	p aː l a m		1. clearly borrowed	1.0	
5489	ZinacantanTzotzil	SHOVEL	pala	pala	pʰ a l a		1. clearly borrowed	1.0	
6895	Qeqchi	SHOVEL	paal	paal	p aː l		1. clearly borrowed	1.0	
8804	Otomi	SHOVEL	pala	pala	p a l a		1. clearly borrowed	1.0	
10682	ImbaburaQuechua	SHOVEL	pala	pala	p a l a		1. clearly borrowed	1.0	
1304	Portuguese	SHOW	mostrar	mostrar	m u ʃ t ɾ a ɾ				
3044	Spanish	SHOW	mostrar; seɲalar	mostrar	m o s t ɾ a ɾ				
3045	Spanish	SHOW	mostrar; seɲalar	seɲalar	s e ɲ a l a ɾ				
4583	Yaqui	SHOW	bittua	bittua	b i t t u a		5. no evidence for borrowing	0.0	
5898	ZinacantanTzotzil	SHOW	7ak’ ta k’elel	7ak’_ta_k’elel	ʔ a kʼ + t a + kʼ e l e l		5. no evidence for borrowing	0.0	
5899	ZinacantanTzotzil	SHOW	ye7	ye7	j e ʔ		5. no evidence for borrowing	0.0	
7541	Qeqchi	SHOW	k'utuk	k'utuk	k ʔ u t u kʰ		5. no evidence for borrowing	0.0	
9594	Otomi	SHOW	udi	udi	u d i		5. no evidence for borrowing	0.0	
9595	Otomi	SHOW	uti	uti	u t̪ i		5. no evidence for borrowing	0.0	
11065	ImbaburaQuechua	SHOW	rikuchina	rikuchina	ʐ i k u tʃ i n a		5. no evidence for borrowing	0.0	
1475	Portuguese	SHRIEK	guinchar	guinchar	ɡ ĩ ʃ a ɾ				
3235	Spanish	SHRIEK	chillar	chillar	tʃ i ʎ a ɾ				
4726	Yaqui	SHRIEK	bwaana	bwaana	bʷ aː n a		5. no evidence for borrowing	0.0	
7733	Qeqchi	SHRIEK	yaab'ak	yaab'ak	j aː ɓ a kʰ		5. no evidence for borrowing	0.0	
9857	Otomi	SHRIEK	mafi	mafi	m a f i		5. no evidence for borrowing	0.0	
9858	Otomi	SHRIEK	nts'ihni	nts'ihni	n tsʼ i h n i		5. no evidence for borrowing	0.0	
11196	ImbaburaQuechua	SHRIEK	kaparina	kaparina	k a p a ɾ i n a		5. no evidence for borrowing	0.0	
1098	Portuguese	SHUT	fechar	fechar	f ɨ ʃ a ɾ				
2831	Spanish	SHUT	cerrar	cerrar	θ ɛ r a ɾ				
4391	Yaqui	SHUT	eta	eta	e t a		5. no evidence for borrowing	0.0	
5737	ZinacantanTzotzil	SHUT	nup' ba	nup'_ba	n u p ɓ a		5. no evidence for borrowing	0.0	
7286	Qeqchi	SHUT	tz'apok	tz'apok	tsʼ a p o kʰ		5. no evidence for borrowing	0.0	
9321	Otomi	SHUT	kot'i	kot'i	k o t̪ʼ i		5. no evidence for borrowing	0.0	
10915	ImbaburaQuechua	SHUT	bichkana	bichkana	b i tʃ k a n a		5. no evidence for borrowing	0.0	
140	Portuguese	SIBLING	irmão; irmã	irmão	i ɾ m ɐ̃ũ				
141	Portuguese	SIBLING	irmão; irmã	irmã	i ɾ m ɐ̃				
1817	Spanish	SIBLING	hermano/ hermana	hermano	ɛ ɾ m a n o				
1818	Spanish	SIBLING	hermano/ hermana	hermana	ɛ ɾ m a n a				
4998	ZinacantanTzotzil	SIBLING	chi7ilil	chi7ilil	tʃʰ i ʔ i l i l		3. perhaps borrowed	0.5	
6273	Qeqchi	SIBLING	anab’	anab’	a n a ɓ		5. no evidence for borrowing	0.0	
8064	Otomi	SIBLING	ku	ku	k u		5. no evidence for borrowing	0.0	
464	Portuguese	SICK	doente; doença	doente	d u ẽ t ɨ				
465	Portuguese	SICK	doente; doença	doença	d u ẽ s ɐ				
2159	Spanish	SICK	enfermo, enfermedad	enfermo	e m f ɛ ɾ m o				
2160	Spanish	SICK	enfermo, enfermedad	enfermedad	e m f ɛ ɾ m e ð a ð				
3855	Yaqui	SICK	ko’okoe	ko’okoe	k o ʔ o k o e		5. no evidence for borrowing	0.0	
5275	ZinacantanTzotzil	SICK	7ip	7ip	ʔ i p		5. no evidence for borrowing	0.0	
6609	Qeqchi	SICK	yaj	yaj	j a x		5. no evidence for borrowing	0.0	
8458	Otomi	SICK	da̲thi	da̲thi	d ɔ θ i		5. no evidence for borrowing	0.0	
10494	ImbaburaQuechua	SICK	unkushka	unkushka	u ŋ g u ʃ k a		5. no evidence for borrowing	0.0	
759	Portuguese	SICKLE OR SCYTHE	foice; gadanha	foice	f oi s ɨ				
760	Portuguese	SICKLE OR SCYTHE	foice; gadanha	gadanha	ɡ ɐ d ɐ ɲ ɐ				
2455	Spanish	SICKLE OR SCYTHE	hoz; guadaɲa	hoz	o θ				
2456	Spanish	SICKLE OR SCYTHE	hoz; guadaɲa	guadaɲa	g w a ð a ɲ a				
4107	Yaqui	SICKLE OR SCYTHE	oosam	oosam	oː s a m		1. clearly borrowed	1.0	
5494	ZinacantanTzotzil	SICKLE OR SCYTHE	hos (2)	hos	h o s		1. clearly borrowed	1.0	
6904	Qeqchi	SICKLE OR SCYTHE	k'onk'ookil ch'iich'	k'onk'ookil_ch'iich'	k ʔ o n kʼ oː k i l + tʃʼ iː tʃʼ		5. no evidence for borrowing	0.0	
8813	Otomi	SICKLE OR SCYTHE	t'e̲xu̲	t'e̲xu̲	t̪ʼ æ x u		5. no evidence for borrowing	0.0	
10688	ImbaburaQuechua	SICKLE OR SCYTHE	usis	usis	u s i s		1. clearly borrowed	1.0	
1114	Portuguese	SIDE	lado	lado	l a d u				
2845	Spanish	SIDE	lado; costado	lado	l a ð o				
2846	Spanish	SIDE	lado; costado	costado	k o s t a ð o				
4402	Yaqui	SIDE	chaka’aria	chaka’aria	tʃ a k a ʔ a r i a		5. no evidence for borrowing	0.0	
5747	ZinacantanTzotzil	SIDE	7ibel	7ibel	ʔ i ɓ e l		5. no evidence for borrowing	0.0	
5748	ZinacantanTzotzil	SIDE	shokon	shokon	ʃ o k o n		5. no evidence for borrowing	0.0	
7301	Qeqchi	SIDE	pak'al	pak'al	p a kʼ a l		5. no evidence for borrowing	0.0	
7302	Qeqchi	SIDE	k'atq sa'	k'atq_sa'	k ʔ a t q + s a ʔ		5. no evidence for borrowing	0.0	
9338	Otomi	SIDE	hyo	hyo	h j o		5. no evidence for borrowing	0.0	
10925	ImbaburaQuechua	SIDE	manya	manya	m a n j a		5. no evidence for borrowing	0.0	
552	Portuguese	SIEVE OR STRAIN	peneira; coador; coar	peneira	p ɨ n ɐi ɾ ɐ				
553	Portuguese	SIEVE OR STRAIN	peneira; coador; coar	coador	k u ɐ d o ɾ				
554	Portuguese	SIEVE OR STRAIN	peneira; coador; coar	coar	k u a ɾ				
2247	Spanish	SIEVE OR STRAIN	cribar; colar; cerner	cribar	k ɾ i β a ɾ				
2248	Spanish	SIEVE OR STRAIN	cribar; colar; cerner	colar	k o l a ɾ				
2249	Spanish	SIEVE OR STRAIN	cribar; colar; cerner	cerner	θ ɛ ɾ n ɛ ɾ				
3931	Yaqui	SIEVE OR STRAIN	kolaroa	kolaroa	k o l a r o a		1. clearly borrowed	1.0	-oa = Nahuatl verbalizer suffix.
5346	ZinacantanTzotzil	SIEVE OR STRAIN	chih	chih	tʃʰ i h		5. no evidence for borrowing	0.0	
5347	ZinacantanTzotzil	SIEVE OR STRAIN	chichin	chichin	tʃʰ i tʃʰ i n		5. no evidence for borrowing	0.0	
6709	Qeqchi	SIEVE OR STRAIN	tz'ilok	tz'ilok	tsʼ i l o kʰ		4. very little evidence for borrowing	0.25	
8572	Otomi	SIEVE OR STRAIN	fats'i	fats'i	f a tsʼ i		5. no evidence for borrowing	0.0	
8573	Otomi	SIEVE OR STRAIN	faki	faki	f a k i		5. no evidence for borrowing	0.0	
10554	ImbaburaQuechua	SIEVE OR STRAIN	shushuna	shushuna	ʃ u ʃ u n a		5. no evidence for borrowing	0.0	
1300	Portuguese	SILENCE	quieto	quieto	k i ɛ t u				
3039	Spanish	SILENCE	silencio; tranquilo	silencio	s i l e n θ j o				
3040	Spanish	SILENCE	silencio; tranquilo	tranquilo	t ɾ a n k i l o				
612	Portuguese	SILK	seda	seda	s ɛ d ɐ				
2303	Spanish	SILK	seda	seda	s e ð a				
3984	Yaqui	SILK	seeda	seeda	s eː d a		1. clearly borrowed	1.0	
5401	ZinacantanTzotzil	SILK	sat xela	sat_xela	s a t + ʃ e l a		5. no evidence for borrowing	0.0	
6767	Qeqchi	SILK	seda	seda	s e d a		1. clearly borrowed	1.0	
8636	Otomi	SILK	seda	seda	s e d a		1. clearly borrowed	1.0	
10598	ImbaburaQuechua	SILK	seda	seda	s e d a		1. clearly borrowed	1.0	
879	Portuguese	SILVER	prata	prata	p ɾ a t ɐ				
2589	Spanish	SILVER	plata	plata	p l a t a				
4203	Yaqui	SILVER	laata ~ plaata	laata	l aː t a		1. clearly borrowed	1.0	
7040	Qeqchi	SILVER	plaat	plaat	p l aː tʰ		1. clearly borrowed	1.0	
7041	Qeqchi	SILVER	saqi ch’iich’	saqi_ch’iich’	s a q i + tʃʼ iː tʃʼ		5. no evidence for borrowing	0.0	
9012	Otomi	SILVER	t'axi (2)	t'axi	t̪ʼ a x i		5. no evidence for borrowing	0.0	
10769	ImbaburaQuechua	SILVER	kulqui	kulqui	k u l q u i		5. no evidence for borrowing	0.0	
1162	Portuguese	SIMILAR	parecido	parecido	p ɐ ɾ ɨ s i d u				
2895	Spanish	SIMILAR	semejante; parecido	semejante	s e m e x a n t e				
2896	Spanish	SIMILAR	semejante; parecido	parecido	p a ɾ e θ i ð o				
4443	Yaqui	SIMILAR	nana’ana	nana’ana	n a n a ʔ a n a		5. no evidence for borrowing	0.0	
5792	ZinacantanTzotzil	SIMILAR	ko7ol	ko7ol	k o ʔ o l		5. no evidence for borrowing	0.0	
5793	ZinacantanTzotzil	SIMILAR	pareho	pareho	pʰ a ɾ e h o		1. clearly borrowed	1.0	
7379	Qeqchi	SIMILAR	chanchan	chanchan	tʃ a n tʃ a n		5. no evidence for borrowing	0.0	
7380	Qeqchi	SIMILAR	jo'	jo'	x o ʔ		5. no evidence for borrowing	0.0	
7381	Qeqchi	SIMILAR	ru	ru	r u		5. no evidence for borrowing	0.0	
9401	Otomi	SIMILAR	hñe̲he̲	hñe̲he̲	h ɲ æ h æ		5. no evidence for borrowing	0.0	
9402	Otomi	SIMILAR	'rangu (2)	'rangu	ˀr a n g u		5. no evidence for borrowing	0.0	
9403	Otomi	SIMILAR	nthe̲	nthe̲	n θ æ		5. no evidence for borrowing	0.0	
9404	Otomi	SIMILAR	mahye̲gi	mahye̲gi	m a h j æ g i		5. no evidence for borrowing	0.0	
9405	Otomi	SIMILAR	mahye̲tho	mahye̲tho	m a h j æ θ o		5. no evidence for borrowing	0.0	
10960	ImbaburaQuechua	SIMILAR	chayshina	chayshina	tʃ a j ʃ i n a		5. no evidence for borrowing	0.0	
1470	Portuguese	SING	cantar	cantar	k ɐ̃ t a ɾ				
3228	Spanish	SING	cantar	cantar	k a n t a ɾ				
4721	Yaqui	SING	bwiika	bwiika	bʷ iː k a		5. no evidence for borrowing	0.0	
6028	ZinacantanTzotzil	SING	k’evuhin	k’evuhin	kʼ e v u h i n		5. no evidence for borrowing	0.0	
7726	Qeqchi	SING	b'ichank	b'ichank	ɓ i tʃ a n kʰ		5. no evidence for borrowing	0.0	
9847	Otomi	SING	tuhu	tuhu	t̪ u h u		5. no evidence for borrowing	0.0	
11191	ImbaburaQuechua	SING	takina	takina	t a k i n a		5. no evidence for borrowing	0.0	
929	Portuguese	SINK (DESCEND)	afundar	afundar	ɐ f ũ d a ɾ				
2645	Spanish	SINK (DESCEND)	hundir	hundir	u n d i ɾ				
4239	Yaqui	SINK (DESCEND)	ba’apo kom siime	ba’apo_kom_siime	b a ʔ a p o + k o m + s iː m e		5. no evidence for borrowing	0.0	
4240	Yaqui	SINK (DESCEND)	ba’a kom simtua	ba’a_kom_simtua	b a ʔ a + k o m + s i m t u a		5. no evidence for borrowing	0.0	
5620	ZinacantanTzotzil	SINK (DESCEND)	muk	muk	m u k		5. no evidence for borrowing	0.0	
7096	Qeqchi	SINK (DESCEND)	muqunk	muqunk	m u q u n kʰ		5. no evidence for borrowing	0.0	
7097	Qeqchi	SINK (DESCEND)	nuq'unk	nuq'unk	n u qʼ u n kʰ		5. no evidence for borrowing	0.0	
7098	Qeqchi	SINK (DESCEND)	sob'e'k	sob'e'k	s o ɓ e ʔ kʰ		5. no evidence for borrowing	0.0	
7099	Qeqchi	SINK (DESCEND)	sub'e'k	sub'e'k	s u ɓ e ʔ kʰ		2. probably borrowed	0.75	
9084	Otomi	SINK (DESCEND)	ku̲i	ku̲i	k u i		5. no evidence for borrowing	0.0	
9085	Otomi	SINK (DESCEND)	ñunt'i	ñunt'i	ɲ u n t̪ʼ i		5. no evidence for borrowing	0.0	
10799	ImbaburaQuechua	SINK (DESCEND)	washajuna	washajuna	w a ʃ a x u n a		5. no evidence for borrowing	0.0	
137	Portuguese	SISTER	irmã	irmã	i ɾ m ɐ̃				
1814	Spanish	SISTER	hermana	hermana	ɛ ɾ m a n a				
3559	Yaqui	SISTER	ako	ako	a k o		5. no evidence for borrowing	0.0	
6270	Qeqchi	SISTER	anab’	anab’	a n a ɓ		5. no evidence for borrowing	0.0	
8058	Otomi	SISTER	nju	nju	n x u		5. no evidence for borrowing	0.0	
8059	Otomi	SISTER	jujwe̲	jujwe̲	x u xʷ æ		5. no evidence for borrowing	0.0	
10254	ImbaburaQuechua	SISTER	ñaña	ñaña	ɲ a ɲ a		5. no evidence for borrowing	0.0	
1082	Portuguese	SIT	sentar-se	sentar-se	s ẽ t a ɾ s ɨ				
2814	Spanish	SIT	sentar	sentar	s e n t a ɾ				
4376	Yaqui	SIT	yejte	yejte	j e j t e		5. no evidence for borrowing	0.0	
4377	Yaqui	SIT	joote	joote	j oː t e		5. no evidence for borrowing	0.0	
5727	ZinacantanTzotzil	SIT	tzuni	tzuni	tsʰ u n i		5. no evidence for borrowing	0.0	
7266	Qeqchi	SIT	chunlaak	chunlaak	tʃ u n l aː kʰ		4. very little evidence for borrowing	0.25	
7267	Qeqchi	SIT	woq'laak	woq'laak	w o qʼ l aː kʰ		5. no evidence for borrowing	0.0	
9295	Otomi	SIT	hudi	hudi	h u d i		5. no evidence for borrowing	0.0	
10903	ImbaburaQuechua	SIT	tiyarina (1)	tiyarina	t i j a ɾ i n a		5. no evidence for borrowing	0.0	
1173	Portuguese	SIX	seis	seis	s ɐi ʃ				
2906	Spanish	SIX	seis	seis	s e i s				
4455	Yaqui	SIX	busani	busani	b u s a n i		5. no evidence for borrowing	0.0	
4456	Yaqui	SIX	seis	seis	s e i s		1. clearly borrowed	1.0	
5800	ZinacantanTzotzil	SIX	vak	vak	v a k		5. no evidence for borrowing	0.0	
7388	Qeqchi	SIX	waqib'	waqib'	w a q i ɓ		5. no evidence for borrowing	0.0	
9413	Otomi	SIX	‘rato	‘rato	ˀr a t̪ o		5. no evidence for borrowing	0.0	
10967	ImbaburaQuechua	SIX	sukta	sukta	s u k t a		5. no evidence for borrowing	0.0	
308	Portuguese	SKIN	pele; couro	pele	p ɛ l ɨ				
309	Portuguese	SKIN	pele; couro	couro	k o ɾ u				
2004	Spanish	SKIN	piel; cutis; pellejo	piel	p j ɛ l				
2005	Spanish	SKIN	piel; cutis; pellejo	cutis	k u t i s				
2006	Spanish	SKIN	piel; cutis; pellejo	pellejo	p e ʎ e x o				
3722	Yaqui	SKIN	beea	beea	b eː a		5. no evidence for borrowing	0.0	
5133	ZinacantanTzotzil	SKIN	nukul	nukul	n u k u l		5. no evidence for borrowing	0.0	
5134	ZinacantanTzotzil	SKIN	nukulal	nukulal	n u k u l a l		5. no evidence for borrowing	0.0	
6454	Qeqchi	SKIN	tz’uumal	tz’uumal	tsʼ uː m a l		5. no evidence for borrowing	0.0	
6455	Qeqchi	SKIN	rix xul	rix_xul	r i ʃ + ʃ u l		5. no evidence for borrowing	0.0	
8308	Otomi	SKIN	xifni	xifni	x i f n i		5. no evidence for borrowing	0.0	
10380	ImbaburaQuechua	SKIN	kara	kara	k a ɾ a		5. no evidence for borrowing	0.0	
635	Portuguese	SKIRT	saia	saia	s ai ɐ				
2326	Spanish	SKIRT	falda	falda	f a l d a				
4009	Yaqui	SKIRT	ko’arim	ko’arim	k o ʔ a r i m		5. no evidence for borrowing	0.0	
5421	ZinacantanTzotzil	SKIRT	tzekil	tzekil	tsʰ e k i l		5. no evidence for borrowing	0.0	
6790	Qeqchi	SKIRT	uuq	uuq	uː qʰ		5. no evidence for borrowing	0.0	
8666	Otomi	SKIRT	ngo̲de	ngo̲de	n g ə d e		5. no evidence for borrowing	0.0	
10616	ImbaburaQuechua	SKIRT	anaku (2)	anaku	a n a k u		5. no evidence for borrowing	0.0	
331	Portuguese	SKULL	crânio; caveira	crânio	k ɾ ɐ n j u				
332	Portuguese	SKULL	crânio; caveira	caveira	k ɐ v ɐi ɾ ɐ				
2026	Spanish	SKULL	cráneo; calavera	cráneo	k ɾ a n e o				
2027	Spanish	SKULL	cráneo; calavera	calavera	k a l a β ɛ ɾ a				
3740	Yaqui	SKULL	koba ota	koba_ota	k o b a + o t a		5. no evidence for borrowing	0.0	
5156	ZinacantanTzotzil	SKULL	hol 7anima	hol_7anima	h o l + ʔ a n i m a		5. no evidence for borrowing	0.0	7anima is from Spanish a*nima ‘soul’
5157	ZinacantanTzotzil	SKULL	bakel hol 7anima	bakel_hol_7anima	ɓ a k e l + h o l + ʔ a n i m a		5. no evidence for borrowing	0.0	7anima is from Spanish a*nima ‘soul’
6473	Qeqchi	SKULL	b'aqel jolom	b'aqel_jolom	ɓ a q e l + x o l o m		5. no evidence for borrowing	0.0	
8326	Otomi	SKULL	doxu̲mo	doxu̲mo	d o x u m o		5. no evidence for borrowing	0.0	
8327	Otomi	SKULL	nju̲nu̲ndo'yo	nju̲nu̲ndo'yo	n x u n u n d o ˀj o		5. no evidence for borrowing	0.0	
10396	ImbaburaQuechua	SKULL	uma tullu	uma_tullu	u m a + t u ʒ u		5. no evidence for borrowing	0.0	
63	Portuguese	SKY	céu	céu	s ɛu				
1742	Spanish	SKY	cielo	cielo	θ j e l o				
3494	Yaqui	SKY	teeka	teeka	t eː k a		5. no evidence for borrowing	0.0	
4924	ZinacantanTzotzil	SKY	vinahel	vinahel	v i n a h e l		5. no evidence for borrowing	0.0	
6192	Qeqchi	SKY	choxa, choxaal	choxa	tʃ o ʃ a		5. no evidence for borrowing	0.0	
